input_name,cleaned_name,input_type,odmp_url,odmp_name,odmp_bio,odmp_age,odmp_tour,odmp_badge,odmp_cause,odmp_end_of_watch,odmp_incident_details,odmp_fuzzy_score,wikidata_occupation,wikidata_race,wikidata_sex,wikidata_birth_date,wikidata_death_date,wikipedia_link,ai_summary,ai_education,ai_dob,ai_dod,ai_place_of_birth,ai_place_of_death,ai_gender,ai_involved_in_sports,ai_involved_in_politics,ai_involved_in_military,ai_involved_in_music
Sherman-Sheridan-Stanton-Custer Highway,ShermanSheridanStantonCuster,highway,,,,,,,,,,,,,,,,,,[],,,,,,,,,
Jeremiah Morrow Bridge,Jeremiah Morrow,highway,,,,,,,,,,,,,,,,,,[],,,,,,,,,
American Legion Memorial Highway,American Legion,highway,,,,,,,,,,,,,,,,,,[],,,,,,,,,
Pearl Harbor Memorial Highway,Pearl Harbor,highway,,,,,,,,,,,,,,,,,,[],,,,,,,,,
Capt. Bartt D. Owens Memorial Highway,Capt Bartt D Owens,highway,,,,,,,,,,,,,,,,,,[],,,,,,,,,
U.S.A.F. Pararescue Memorial Parkway,USAF Pararescue,highway,,,,,,,,,,,,,,,,,,[],,,,,,,,,
Captain Seth Mitchell Memorial Highway,Captain Seth Mitchell,highway,,,,,,,,,,,,,,,,,,[],,,,,,,,,
Sergeant Brian Dulle Memorial Highway,Sergeant Brian Dulle,highway,,,,,,,,,,,,,,,,,,[],,,,,,,,,
"SFC William B. Woods, Jr. Memorial Highway",SFC William B Woods Jr,highway,,,,,,,,,,,,,,,,,,[],,,,,,,,,
SFC Bobby Lee Estle Memorial Highway,SFC Bobby Lee Estle,highway,,,,,,,,,,,,,,,,,,[],,,,,,,,,
Officer Bill Johnson Memorial Highway ,Officer Bill Johnson Memorial Highway,highway,,,,,,,,,,,,,,,,,,[],,,,,,,,,
Neil Armstrong Memorial Way,Neil Armstrong,highway,,,,,,,,,,,,,,,,,,[],,,,,,,,,
Officer Ciera N. Greene Memorial Highway,Officer Ciera N Greene,highway,,,,,,,,,,,,,,,,,,[],,,,,,,,,
Natural Resources Officer Jason Lagore Memorial Highway,Natural Resources Officer Jason Lagore,highway,,,,,,,,,,,,,,,,,,[],,,,,,,,,
PFC Jerry D. Leak Memorial Highway,PFC Jerry D Leak,highway,,,,,,,,,,,,,,,,,,[],,,,,,,,,
"PFC Edward O’Dell Mullins, Jr. Memorial Bridge",PFC Edward ODell Mullins Jr,highway,,,,,,,,,,,,,,,,,,[],,,,,,,,,
"SFC John E. Conger, Jr. Memorial Highway",SFC John E Conger Jr,highway,,,,,,,,,,,,,,,,,,[],,,,,,,,,
Veterans Suicide Memorial Mile,Veterans Suicide Memorial Mile,highway,,,,,,,,,,,,,,,,,,[],,,,,,,,,
 SFC Charles E. Carpenter Memorial Highway,SFC Charles E Carpenter,highway,,,,,,,,,,,,,,,,,,[],,,,,,,,,
Specialist Five Frederick Wayne Taylor Memorial Highway,Specialist Five Frederick Wayne Taylor,highway,,,,,,,,,,,,,,,,,,[],,,,,,,,,
Eighty-third Division Memorial Highway,Eightythird Division,highway,,,,,,,,,,,,,,,,,,[],,,,,,,,,
George Washington Highway,George Washington,highway,,,,,,,,,,,,,,,,,,[],,,,,,,,,
First Lt. Christopher Rutherford Memorial Highway,First Lt Christopher Rutherford,highway,,,,,,,,,,,,,,,,,,[],,,,,,,,,
U.S. Army Specialist Allen Nolan Memorial Highway,US Army Specialist Allen Nolan,highway,,,,,,,,,,,,,,,,,,[],,,,,,,,,
U.S. Army Specialist Christian D. Ward Memorial Highway,US Army Specialist Christian D Ward,highway,,,,,,,,,,,,,,,,,,[],,,,,,,,,
State Representative Andy Thompson Memorial Highway,State Representative Andy Thompson,highway,,,,,,,,,,,,,,,,,,[],,,,,,,,,
SGT Meredith L. Barnett Memorial Highway,SGT Meredith L Barnett,highway,,,,,,,,,,,,,,,,,,[],,,,,,,,,
Town and Country Firefighter Lt. Philip M. Wigal Memorial Highway,Town and Country Firefighter Lt Philip M Wigal,highway,,,,,,,,,,,,,,,,,,[],,,,,,,,,
Thirty-seventh Division Memorial Highway,Thirtyseventh Division,highway,,,,,,,,,,,,,,,,,,[],,,,,,,,,
Forty-second Rainbow Division Memorial Highway,Fortysecond Rainbow Division,highway,,,,,,,,,,,,,,,,,,[],,,,,,,,,
Ralph Regula Memorial Highway ,Ralph Regula Memorial Highway,highway,,,,,,,,,,,,,,,,,,[],,,,,,,,,
"First Lieutenant John M. Runkle, Jr. Memorial Highway",First Lieutenant John M Runkle Jr,highway,,,,,,,,,,,,,,,,,,[],,,,,,,,,
Wayne County Gold Star Family Memorial Highway,Wayne County Gold Star Family,highway,,,,,,,,,,,,,,,,,,[],,,,,,,,,
Gold and Blue Star Family Memorial Bridge,Gold and Blue Star Family,highway,,,,,,,,,,,,,,,,,,[],,,,,,,,,
POW/MIA Memorial Viaduct,POWMIA Memorial Viaduct,highway,,,,,,,,,,,,,,,,,,[],,,,,,,,,
The Grand Army of the Republic Highway,The Grand Army of the Republic,highway,,,,,,,,,,,,,,,,,,[],,,,,,,,,
General McPherson Highway,General McPherson,highway,,,,,,,,,,,,,,,,,,[],,,,,,,,,
Williams County Veterans Memorial Highway,Williams County Veterans,highway,,,,,,,,,,,,,,,,,,[],,,,,,,,,
U.S. Army Private First Class Jerry Brockbrader Memorial Highway,US Army Private First Class Jerry Brockbrader,highway,,,,,,,,,,,,,,,,,,[],,,,,,,,,
The Grand Army of the Republic Highway,The Grand Army of the Republic,highway,,,,,,,,,,,,,,,,,,[],,,,,,,,,
General McPherson Highway,General McPherson,highway,,,,,,,,,,,,,,,,,,[],,,,,,,,,
United Spanish War Veterans Memorial Highway,United Spanish War Veterans,highway,,,,,,,,,,,,,,,,,,[],,,,,,,,,
Johnny Appleseed Highway,Johnny Appleseed,highway,,,,,,,,,,,,,,,,,,[],,,,,,,,,
American Legion Memorial Highway,American Legion,highway,,,,,,,,,,,,,,,,,,[],,,,,,,,,
Pearl Harbor Memorial Highway,Pearl Harbor,highway,,,,,,,,,,,,,,,,,,[],,,,,,,,,
Rosa Parks Highway,Rosa Parks,highway,,,,,,,,,,,,,,,,,,[],,,,,,,,,
Korean War Veterans' Memorial Highway,Korean War Veterans,highway,,,,,,,,,,,,,,,,,,[],,,,,,,,,
Lt Col Thomas P. Belkofer Memorial Highway ,Lt Col Thomas P Belkofer Memorial Highway,highway,,,,,,,,,,,,,,,,,,[],,,,,,,,,
Marine Sgt. David R. Christoff Memorial Highway,Marine Sgt David R Christoff,highway,,,,,,,,,,,,,,,,,,[],,,,,,,,,
Staff Sergeant Bradley C. Hart Memorial Roadway,Staff Sergeant Bradley C Hart,highway,,,,,,,,,,,,,,,,,,[],,,,,,,,,
Lake Township Veterans Memorial Highway,Lake Township Veterans,highway,,,,,,,,,,,,,,,,,,[],,,,,,,,,
"Master Chief Special Warfare Operator (SEAL) Edward C. Byers, Jr. Medal of Honor Recipient Highway",Master Chief Special Warfare Operator SEAL Edward C Byers Jr Medal of Honor Recipient,highway,,,,,,,,,,,,,,,,,,[],,,,,,,,,
" SGT Arthur A. Mora, Jr. Memorial Highway",SGT Arthur A Mora Jr,highway,,,,,,,,,,,,,,,,,,[],,,,,,,,,
United Spanish War Veterans Memorial Highway / Scioto Trail,United Spanish War Veterans Memorial Highway  Scioto,highway,,,,,,,,,,,,,,,,,,[],,,,,,,,,
First Lt. Harry L. Martin Memorial Highway,First Lt Harry L Martin,highway,,,,,,,,,,,,,,,,,,[],,,,,,,,,
Trooper Andrew C. Baldridge Memorial Highway,Trooper Andrew C Baldridge,highway,,,,,,,,,,,,,,,,,,[],,,,,,,,,
OSHP Sgt. John F. Best Memorial Highway,OSHP Sgt John F Best,highway,,,,,,,,,,,,,,,,,,[],,,,,,,,,
