input_name,cleaned_name,input_type,odmp_url,odmp_name,odmp_bio,odmp_age,odmp_tour,odmp_badge,odmp_cause,odmp_end_of_watch,odmp_incident_details,odmp_fuzzy_score,wikidata_occupation,wikidata_race,wikidata_sex,wikidata_birth_date,wikidata_death_date,wikipedia_link,ai_summary,ai_education,ai_dob,ai_dod,ai_place_of_birth,ai_place_of_death,ai_gender,ai_involved_in_sports,ai_involved_in_politics,ai_involved_in_military,ai_involved_in_music
Poland Township Police Officer Charles K. Yates Memorial Highway ,Poland Township Police Officer Charles K Yates Memorial Highway,highway,,,,,,,,,,,,,,,,,,[],,,,,,,,,
Harry Meshel Memorial Highway ,Harry Meshel Memorial Highway,highway,,,,,,,,,,,,,,,,,,[],,,,,,,,,
Frank Watson Memorial Highway ,Frank Watson Memorial Highway,highway,,,,,,,,,,,,,,,,,,[],,,,,,,,,
Women Veterans Bridge ,Women Veterans Bridge,highway,,,,,,,,,,,,,,,,,,[],,,,,,,,,
Army Chief Warrant Officer Donald V. Clark Memorial Highway,Army Chief Warrant Officer Donald V Clark,highway,,,,,,,,,,,,,,,,,,[],,,,,,,,,
Air Force 2nd Lt. William Vaughan Memorial Bridge,Air Force 2nd Lt William Vaughan,highway,,,,,,,,,,,,,,,,,,[],,,,,,,,,
Joeseph K. Vrabel 'Ohio Veterans Hall of Fame' Memorial Highway,Joeseph K Vrabel Ohio Veterans Hall of Fame,highway,,,,,,,,,,,,,,,,,,[],,,,,,,,,
PFC Ronald J. Puskarcik Memorial Highway,PFC Ronald J Puskarcik,highway,,,,,,,,,,,,,,,,,,[],,,,,,,,,
Canfield Armed Forces Bridge,Canfield Armed Forces,highway,,,,,,,,,,,,,,,,,,[],,,,,,,,,
Canfield First Responders Bridge,Canfield First Responders,highway,,,,,,,,,,,,,,,,,,[],,,,,,,,,
"Lewis John Speece, Jr. Memorial Bridge",Lewis John Speece Jr,highway,,,,,,,,,,,,,,,,,,[],,,,,,,,,
United Spanish War Veterans Memorial Highway / Scioto Trail,United Spanish War Veterans Memorial Highway  Scioto,highway,,,,,,,,,,,,,,,,,,[],,,,,,,,,
Army Cpt. Stephen J. Chaney Memorial Highway,Army Cpt Stephen J Chaney,highway,,,,,,,,,,,,,,,,,,[],,,,,,,,,
Wright Brothers Memorial Highway,Wright Brothers,highway,,,,,,,,,,,,,,,,,,[],,,,,,,,,
General Thaddeus Kosciusko Memorial Highway,General Thaddeus Kosciusko,highway,,,,,,,,,,,,,,,,,,[],,,,,,,,,
Deputy Brandy Winfield Memorial Highway,Deputy Brandy Winfield,highway,,,,,,,,,,,,,,,,,,[],,,,,,,,,
Deputy Sheriff Bill Bender and Trooper Randy Bender Memorial Highway,Deputy Sheriff Bill Bender and Trooper Randy Bender,highway,,,,,,,,,,,,,,,,,,[],,,,,,,,,
SGT David S. Harris Memorial Highway,SGT David S Harris,highway,,,,,,,,,,,,,,,,,,[],,,,,,,,,
The Military Order of the Purple Heart Memorial Highway,The Military Order of the Purple Heart,highway,,,,,,,,,,,,,,,,,,[],,,,,,,,,
Thirty-seventh Division Memorial Highway,Thirtyseventh Division,highway,,,,,,,,,,,,,,,,,,[],,,,,,,,,
Forty-second Rainbow Division Memorial Highway,Fortysecond Rainbow Division,highway,,,,,,,,,,,,,,,,,,[],,,,,,,,,
Sergeant James F. Allen III Memorial Highway ,Sergeant James F Allen III Memorial Highway,highway,,,,,,,,,,,,,,,,,,[],,,,,,,,,
"Sgt. Michael W. Finke, Jr., Memorial Highway",Sgt Michael W Finke Jr,highway,,,,,,,,,,,,,,,,,,[],,,,,,,,,
Captain ‘Smokey’ Carl Edward Summers Memorial Highway,Captain Smokey Carl Edward Summers,highway,,,,,,,,,,,,,,,,,,[],,,,,,,,,
Governor Robert Lucas Highway,Governor Robert Lucas,highway,,,,,,,,,,,,,,,,,,[],,,,,,,,,
Marine Corps League memorial highway,Marine Corps League,highway,,,,,,,,,,,,,,,,,,[],,,,,,,,,
Staff Sergeant Jimmy G. Stewart Veterans Bridge,Staff Sergeant Jimmy G Stewart Veterans,highway,,,,,,,,,,,,,,,,,,[],,,,,,,,,
Earle Baltes Highway,Earle Baltes,highway,,,,,,,,,,,,,,,,,,[],,,,,,,,,
Marine Corps League memorial highway,Marine Corps League,highway,,,,,,,,,,,,,,,,,,[],,,,,,,,,
American Legion Memorial Highway,American Legion,highway,,,,,,,,,,,,,,,,,,[],,,,,,,,,
Pearl Harbor Memorial Highway,Pearl Harbor,highway,,,,,,,,,,,,,,,,,,[],,,,,,,,,
"Sheriff's Sgt. Robert ""Bobby"" Elliott Memorial Highway",Sheriffs Sgt Robert Bobby Elliott,highway,,,,,,,,,,,,,,,,,,[],,,,,,,,,
Korean War Veterans' Memorial Highway,Korean War Veterans,highway,,,,,,,,,,,,,,,,,,[],,,,,,,,,
Cpl. Samuel F. Pearson Memorial Highway,Cpl Samuel F Pearson,highway,,,,,,,,,,,,,,,,,,[],,,,,,,,,
U.S.A.F. Pararescue Memorial Parkway,USAF Pararescue,highway,,,,,,,,,,,,,,,,,,[],,,,,,,,,
Robert E. Netzley Highway,Robert E Netzley,highway,,,,,,,,,,,,,,,,,,[],,,,,,,,,
"U.S.M.C. Lance Corporal Dustin R. Fitzgerald ""Dusty"" Memorial Highway",USMC Lance Corporal Dustin R Fitzgerald Dusty,highway,,,,,,,,,,,,,,,,,,[],,,,,,,,,
PFC Marc L. Cole Memorial Highway,PFC Marc L Cole,highway,,,,,,,,,,,,,,,,,,[],,,,,,,,,
Pfc. Jeffrey L. Rice Memorial Highway,Pfc Jeffrey L Rice,highway,,,,,,,,,,,,,,,,,,[],,,,,,,,,
Ohio State Highway Patrol MCEI Kimra Skelton Memorial Highway,Ohio State Highway Patrol MCEI Kimra Skelton,highway,,,,,,,,,,,,,,,,,,[],,,,,,,,,
Sheriff Sergeant William ‘Bill’ Morris Memorial Highway,Sheriff Sergeant William Bill Morris,highway,,,,,,,,,,,,,,,,,,[],,,,,,,,,
Sgt. Herman Zerger Highway,Sgt Herman Zerger,highway,,,,,,,,,,,,,,,,,,[],,,,,,,,,
78th Ohio Veteran Volunteer Infantry Highway,78th Ohio Veteran Volunteer Infantry,highway,,,,,,,,,,,,,,,,,,[],,,,,,,,,
Wright Brothers Memorial Highway,Wright Brothers,highway,,,,,,,,,,,,,,,,,,[],,,,,,,,,
American Legion Memorial Highway,American Legion,highway,,,,,,,,,,,,,,,,,,[],,,,,,,,,
Pearl Harbor Memorial Highway,Pearl Harbor,highway,,,,,,,,,,,,,,,,,,[],,,,,,,,,
John Kalaman and Robert O'Toole Memorial Highway,John Kalaman and Robert OToole,highway,,,,,,,,,,,,,,,,,,[],,,,,,,,,
Freedom Memorial Highway,Freedom,highway,,,,,,,,,,,,,,,,,,[],,,,,,,,,
"Joseph Guy LaPointe, Jr. Memorial Parkway",Joseph Guy LaPointe Jr,highway,,,,,,,,,,,,,,,,,,[],,,,,,,,,
U.S.A.F. Pararescue Memorial Parkway,USAF Pararescue,highway,,,,,,,,,,,,,,,,,,[],,,,,,,,,
Marine Corporal Paul W. Zanowick II Memorial Highway,Marine Corporal Paul W Zanowick II,highway,,,,,,,,,,,,,,,,,,[],,,,,,,,,
"U.S.M.C. Lance Corporal Dustin R. Fitzgerald ""Dusty"" Memorial Highway",USMC Lance Corporal Dustin R Fitzgerald Dusty,highway,,,,,,,,,,,,,,,,,,[],,,,,,,,,
"U.S. Army Private First Class James P. White, Jr. ""J.P."" Memorial Highway",US Army Private First Class James P White Jr JP,highway,,,,,,,,,,,,,,,,,,[],,,,,,,,,
SGT Gary Lee McKiddy Memorial Highway,SGT Gary Lee McKiddy,highway,,,,,,,,,,,,,,,,,,[],,,,,,,,,
Sgt. Cameron H. Thomas Memorial Way,Sgt Cameron H Thomas,highway,,,,,,,,,,,,,,,,,,[],,,,,,,,,
Sgt. Kevin J. Lannon Memorial Way,Sgt Kevin J Lannon,highway,,,,,,,,,,,,,,,,,,[],,,,,,,,,
CWO3 James E. Groves III Memorial Highway,CWO3 James E Groves III,highway,,,,,,,,,,,,,,,,,,[],,,,,,,,,
78th Ohio Veteran Volunteer Infantry Highway,78th Ohio Veteran Volunteer Infantry,highway,,,,,,,,,,,,,,,,,,[],,,,,,,,,
Forty-second Rainbow Division Memorial Highway,Fortysecond Rainbow Division,highway,,,,,,,,,,,,,,,,,,[],,,,,,,,,
Lieutenant Michael J. Lutz Memorial Highway.,Lieutenant Michael J Lutz Memorial Highway,highway,,,,,,,,,,,,,,,,,,[],,,,,,,,,
"Deputy Sheriff Robert M. Tanner, Jr . Memorial Highway.",Deputy Sheriff Robert M Tanner Jr  Memorial Highway,highway,,,,,,,,,,,,,,,,,,[],,,,,,,,,
"U.S. Army Staff Sergeant Lester O. ""Buddy"" Kinney II Memorial Highway",US Army Staff Sergeant Lester O Buddy Kinney II,highway,,,,,,,,,,,,,,,,,,[],,,,,,,,,
Sherman-Sheridan-Stanton-Custer Highway,ShermanSheridanStantonCuster,highway,,,,,,,,,,,,,,,,,,[],,,,,,,,,
Staff Sergeant George P. Mizik (USMC) Memorial Highway,Staff Sergeant George P Mizik USMC,highway,,,,,,,,,,,,,,,,,,[],,,,,,,,,
U.S.S. Shenandoah Memorial Highway,USS Shenandoah,highway,,,,,,,,,,,,,,,,,,[],,,,,,,,,
Eighty-third Division Memorial Highway,Eightythird Division,highway,,,,,,,,,,,,,,,,,,[],,,,,,,,,
Sampson Harris Memorial Bridge,Sampson Harris,highway,,,,,,,,,,,,,,,,,,[],,,,,,,,,
Freeman C. Thompson Memorial Bridge,Freeman C Thompson,highway,,,,,,,,,,,,,,,,,,[],,,,,,,,,
78th Ohio Veteran Volunteer Infantry Highway,78th Ohio Veteran Volunteer Infantry,highway,,,,,,,,,,,,,,,,,,[],,,,,,,,,
Navy Diver 1st Class James E. Reyhar Memorial Highway,Navy Diver 1st Class James E Reyhar,highway,,,,,,,,,,,,,,,,,,[],,,,,,,,,
Ottawa County Veterans Memorial Highway,Ottawa County Veterans,highway,,,,,,,,,,,,,,,,,,[],,,,,,,,,
Thomas A. Edison Memorial Bridge,Thomas A Edison,highway,,,,,,,,,,,,,,,,,,[],,,,,,,,,
Officer William J. Hetrick Memorial Highway,Officer William J Hetrick,highway,,,,,,,,,,,,,,,,,,[],,,,,,,,,
Sgt. Jordan Marshall Memorial Highway ,Sgt Jordan Marshall Memorial Highway,highway,,,,,,,,,,,,,,,,,,[],,,,,,,,,
SGT Glen Millinger Memorial Highway ,SGT Glen Millinger Memorial Highway,highway,,,,,,,,,,,,,,,,,,[],,,,,,,,,
Army Sgt. Keith Kline Memorial Highway,Army Sgt Keith Kline,highway,,,,,,,,,,,,,,,,,,[],,,,,,,,,
Catawba Island Township Veterans Memorial Highway,Catawba Island Township Veterans,highway,,,,,,,,,,,,,,,,,,[],,,,,,,,,
Staff Sgt. Zachary Wobler Memorial Highway,Staff Sgt Zachary Wobler,highway,,,,,,,,,,,,,,,,,,[],,,,,,,,,
Paulding Count Purple Heart Memorial Highway,Paulding Count Purple Heart,highway,,,,,,,,,,,,,,,,,,[],,,,,,,,,
U.S. Navy Petty Officer 2nd Class Randall Smith Memorial Highway,US Navy Petty Officer 2nd Class Randall Smith,highway,,,,,,,,,,,,,,,,,,[],,,,,,,,,
Sherman-Sheridan-Stanton-Custer Highway,ShermanSheridanStantonCuster,highway,,,,,,,,,,,,,,,,,,[],,,,,,,,,
Crooksville Firefighters David Theisen and Stephen Carletti Memorial Highway,Crooksville Firefighters David Theisen and Stephen Carletti,highway,,,,,,,,,,,,,,,,,,[],,,,,,,,,
United Spanish War Veterans Memorial Highway / Scioto Trail,United Spanish War Veterans Memorial Highway  Scioto,highway,,,,,,,,,,,,,,,,,,[],,,,,,,,,
Sherman-Sheridan-Stanton-Custer Highway,ShermanSheridanStantonCuster,highway,,,,,,,,,,,,,,,,,,[],,,,,,,,,
Army Specialist Gerald R. Jenkins Memorial Highway,Army Specialist Gerald R Jenkins,highway,,,,,,,,,,,,,,,,,,[],,,,,,,,,
Army PFC Kevin C. Ott Memorial Highway,Army PFC Kevin C Ott,highway,,,,,,,,,,,,,,,,,,[],,,,,,,,,
Detective Corporal J. Phillip Brown Memorial Highway,Detective Corporal J Phillip Brown,highway,,,,,,,,,,,,,,,,,,[],,,,,,,,,
"Captain Everett ""Butch"" Keaton Memorial Highway",Captain Everett Butch Keaton,highway,,,,,,,,,,,,,,,,,,[],,,,,,,,,
United Spanish War Veterans Memorial Highway / Scioto Trail,United Spanish War Veterans Memorial Highway  Scioto,highway,,,,,,,,,,,,,,,,,,[],,,,,,,,,
"Army PFC Walter Earl Duncan, Jr. Memorial Highway",Army PFC Walter Earl Duncan Jr,highway,,,,,,,,,,,,,,,,,,[],,,,,,,,,
Governor Robert Lucas Highway,Governor Robert Lucas,highway,,,,,,,,,,,,,,,,,,[],,,,,,,,,
Old Zane Trace Memorial Highway,Old Zane Trace,highway,,,,,,,,,,,,,,,,,,[],,,,,,,,,
U.S. Army Specialist Justin Helton Memorial Highway,US Army Specialist Justin Helton,highway,,,,,,,,,,,,,,,,,,[],,,,,,,,,
Patrolman William J. Keller Memorial Highway,Patrolman William J Keller,highway,,,,,,,,,,,,,,,,,,[],,,,,,,,,
The Military Order of the Purple Heart Memorial Highway,The Military Order of the Purple Heart,highway,,,,,,,,,,,,,,,,,,[],,,,,,,,,
The Luke 'Doc' Emch and Matt 'Doc' Conte Corpsmen Memorial Highway,The Luke Doc Emch and Matt Doc Conte Corpsmen,highway,,,,,,,,,,,,,,,,,,[],,,,,,,,,
Corporal Jason J. Hernandez Memorial Highway,Corporal Jason J Hernandez,highway,,,,,,,,,,,,,,,,,,[],,,,,,,,,
Gold Star Mothers' Memorial Highway,Gold Star Mothers,highway,,,,,,,,,,,,,,,,,,[],,,,,,,,,
Sgt. Jeremy Murray Memorial Highway,Sgt Jeremy Murray,highway,,,,,,,,,,,,,,,,,,[],,,,,,,,,
Spc. Adam S. Hamilton Memorial Highway,Spc Adam S Hamilton,highway,,,,,,,,,,,,,,,,,,[],,,,,,,,,
"CPL Benjamin C. Dillon, RLTW, Memorial Highway",CPL Benjamin C Dillon RLTW,highway,,,,,,,,,,,,,,,,,,[],,,,,,,,,
Governor Andrew L. Harris Bicentennial Roadway,Governor Andrew L Harris Bicentennial,highway,,,,,,,,,,,,,,,,,,[],,,,,,,,,
Putnam County Veterans Memorial Highway,Putnam County Veterans,highway,,,,,,,,,,,,,,,,,,[],,,,,,,,,
"PFC Richard ""Rick"" Wesley McFarland Memorial Highway",PFC Richard Rick Wesley McFarland,highway,,,,,,,,,,,,,,,,,,[],,,,,,,,,
Firefighter Charles D. Swank Memorial Highway,Firefighter Charles D Swank,highway,,,,,,,,,,,,,,,,,,[],,,,,,,,,
"SM1 Corenlius Anthony McCafferty, Jr. Memorial Highway",SM1 Corenlius Anthony McCafferty Jr,highway,,,,,,,,,,,,,,,,,,[],,,,,,,,,
Forty-second Rainbow Division Memorial Highway,Fortysecond Rainbow Division,highway,,,,,,,,,,,,,,,,,,[],,,,,,,,,
Richland County Veterans Memorial Highway,Richland County Veterans,highway,,,,,,,,,,,,,,,,,,[],,,,,,,,,
"Lt. Col. Albert L. Allen, Jr., Memorial Highway",Lt Col Albert L Allen Jr,highway,,,,,,,,,,,,,,,,,,[],,,,,,,,,
PFC Steven D. Smith Memorial Highway,PFC Steven D Smith,highway,,,,,,,,,,,,,,,,,,[],,,,,,,,,
Lance Cpl. Aaron Reed Memorial Highway,Lance Cpl Aaron Reed,highway,,,,,,,,,,,,,,,,,,[],,,,,,,,,
United Spanish War Veterans Memorial Highway / Scioto Trail,United Spanish War Veterans Memorial Highway  Scioto,highway,,,,,,,,,,,,,,,,,,[],,,,,,,,,
George Washington Highway,George Washington,highway,,,,,,,,,,,,,,,,,,[],,,,,,,,,
General Duncan McArthur Highway,General Duncan McArthur,highway,,,,,,,,,,,,,,,,,,[],,,,,,,,,
Old Zane Trace Memorial Highway,Old Zane Trace,highway,,,,,,,,,,,,,,,,,,[],,,,,,,,,
Camp Sherman Memorial Highway,Camp Sherman,highway,,,,,,,,,,,,,,,,,,[],,,,,,,,,
Great Seal Memorial Highway,Great Seal,highway,,,,,,,,,,,,,,,,,,[],,,,,,,,,
Great Seal Memorial Highway,Great Seal,highway,,,,,,,,,,,,,,,,,,[],,,,,,,,,
Army Specialist Gavin Colburn Memorial Highway,Army Specialist Gavin Colburn,highway,,,,,,,,,,,,,,,,,,[],,,,,,,,,
Air Force Master Sergeant Brad Clemmons Memorial Highway,Air Force Master Sergeant Brad Clemmons,highway,,,,,,,,,,,,,,,,,,[],,,,,,,,,
Staff Sergeant Joshua Gire Memorial Highway,Staff Sergeant Joshua Gire,highway,,,,,,,,,,,,,,,,,,[],,,,,,,,,
Deputy Lawrence Barnes Memorial Bridge,Deputy Lawrence Barnes,highway,,,,,,,,,,,,,,,,,,[],,,,,,,,,
SGT Michael Keith Hamner Memorial Highway,SGT Michael Keith Hamner,highway,,,,,,,,,,,,,,,,,,[],,,,,,,,,
The Grand Army of the Republic Highway,The Grand Army of the Republic,highway,,,,,,,,,,,,,,,,,,[],,,,,,,,,
General McPherson Highway,General McPherson,highway,,,,,,,,,,,,,,,,,,[],,,,,,,,,
Lance Corporal Jeremy S. Shock Memorial Highway,Lance Corporal Jeremy S Shock,highway,,,,,,,,,,,,,,,,,,[],,,,,,,,,
Army Sgt. Jon Martin Memorial Highway,Army Sgt Jon Martin,highway,,,,,,,,,,,,,,,,,,[],,,,,,,,,
Teresa Miller-Martin 9/11 Memorial Highway,Teresa MillerMartin 911,highway,,,,,,,,,,,,,,,,,,[],,,,,,,,,
The Atlantic and Pacific Highway,The Atlantic and Pacific,highway,,,,,,,,,,,,,,,,,,[],,,,,,,,,
Branch Rickey Memorial Highway,Branch Rickey,highway,,,,,,,,,,,,,,,,,,[],,,,,,,,,
United Spanish War Veterans Memorial Highway / Scioto Trail,United Spanish War Veterans Memorial Highway  Scioto,highway,,,,,,,,,,,,,,,,,,[],,,,,,,,,
U.S.M.C. LCpl Jonatahn Etterling Memorial Highway,USMC LCpl Jonatahn Etterling,highway,,,,,,,,,,,,,,,,,,[],,,,,,,,,
Roy Rogers Happy Trails Highway ,Roy Rogers Happy Trails Highway,highway,,,,,,,,,,,,,,,,,,[],,,,,,,,,
Southern Ohio Veterans Memorial Highway,Southern Ohio Veterans,highway,,,,,,,,,,,,,,,,,,[],,,,,,,,,
United Spanish War Veterans Memorial Highway,United Spanish War Veterans,highway,,,,,,,,,,,,,,,,,,[],,,,,,,,,
Wright Brothers Memorial Highway,Wright Brothers,highway,,,,,,,,,,,,,,,,,,[],,,,,,,,,
Lance Corporal Jeremy S. Shock Memorial Highway,Lance Corporal Jeremy S Shock,highway,,,,,,,,,,,,,,,,,,[],,,,,,,,,
American Legion Memorial Highway,American Legion,highway,,,,,,,,,,,,,,,,,,[],,,,,,,,,
Pearl Harbor Memorial Highway,Pearl Harbor,highway,,,,,,,,,,,,,,,,,,[],,,,,,,,,
Michael J. Aselage Memorial Highway ,Michael J Aselage Memorial Highway,highway,,,,,,,,,,,,,,,,,,[],,,,,,,,,
U.S.A.F. Pararescue Memorial Parkway,USAF Pararescue,highway,,,,,,,,,,,,,,,,,,[],,,,,,,,,
SFC Charles Gregory Huston Memorial Highway,SFC Charles Gregory Huston,highway,,,,,,,,,,,,,,,,,,[],,,,,,,,,
Patrolman James P. Gardner Memorial Highway,Patrolman James P Gardner,highway,,,,,,,,,,,,,,,,,,[],,,,,,,,,
Patrolman Sean VanDenberg Memorial Highway,Patrolman Sean VanDenberg,highway,,,,,,,,,,,,,,,,,,[],,,,,,,,,
Sgt. Cory M. Endlich Corridor,Sgt Cory M Endlich,highway,,,,,,,,,,,,,,,,,,[],,,,,,,,,
"PFC Burt ""Rusty"" Miller Memorial Highway",PFC Burt Rusty Miller,highway,,,,,,,,,,,,,,,,,,[],,,,,,,,,
"Lance Corporal Michael Stangelo, USMC, Memorial Bridge",Lance Corporal Michael Stangelo USMC,highway,,,,,,,,,,,,,,,,,,[],,,,,,,,,
Eighty-third Division Memorial Highway,Eightythird Division,highway,,,,,,,,,,,,,,,,,,[],,,,,,,,,
U.S.M.C. Pvt. Heath Warner Memorial Highway,USMC Pvt Heath Warner,highway,,,,,,,,,,,,,,,,,,[],,,,,,,,,
U.S.M.C. Sgt. Daniel J. Patron Memorial Highway,USMC Sgt Daniel J Patron,highway,,,,,,,,,,,,,,,,,,[],,,,,,,,,
First Lt. Ashley White-Stumpf Memorial Highway,First Lt Ashley WhiteStumpf,highway,,,,,,,,,,,,,,,,,,[],,,,,,,,,
Sgt. Michael Barkey Memorial Highway,Sgt Michael Barkey,highway,,,,,,,,,,,,,,,,,,[],,,,,,,,,
Larry Morgan Memorial Highway,Larry Morgan,highway,,,,,,,,,,,,,,,,,,[],,,,,,,,,
Captain Daniel Stiles Memorial Highway,Captain Daniel Stiles,highway,,,,,,,,,,,,,,,,,,[],,,,,,,,,
Sgt. 1st Class Daniel B. Crabtree Memorial Road,Sgt 1st Class Daniel B Crabtree,highway,,,,,,,,,,,,,,,,,,[],,,,,,,,,
Lance Corporal Daniel McVicker Memorial Highway,Lance Corporal Daniel McVicker,highway,,,,,,,,,,,,,,,,,,[],,,,,,,,,
Staff Sgt. Kevin J. Kessler Memorial Highway,Staff Sgt Kevin J Kessler,highway,,,,,,,,,,,,,,,,,,[],,,,,,,,,
U.S. Army Cpl. Zachary Grass Memorial Highway,US Army Cpl Zachary Grass,highway,,,,,,,,,,,,,,,,,,[],,,,,,,,,
Football Heritage Corridor,Football Heritage,highway,,,,,,,,,,,,,,,,,,[],,,,,,,,,
Lt. Jason S. Manse Memorial Highway,Lt Jason S Manse,highway,,,,,,,,,,,,,,,,,,[],,,,,,,,,
Fred Krum Memorial Interchange,Fred Krum,highway,,,,,,,,,,,,,,,,,,[],,,,,,,,,
USMC LCpl Stacy (Annie) Dryden Memorial Highway,USMC LCpl Stacy Annie Dryden,highway,,,,,,,,,,,,,,,,,,[],,,,,,,,,
Army Sgt. Vernon R. Judd Memorial Highway,Army Sgt Vernon R Judd,highway,,,,,,,,,,,,,,,,,,[],,,,,,,,,
First Lt. Ashley White Memorial Highway,First Lt Ashley White,highway,,,,,,,,,,,,,,,,,,[],,,,,,,,,
Jackson Township Veterans Memorial Parkway,Jackson Township Veterans,highway,,,,,,,,,,,,,,,,,,[],,,,,,,,,
Markers on state and federal highways at points crossed by Morgan's raiders,Markers on state and federal highways at points crossed by Morgans raiders,highway,,,,,,,,,,,,,,,,,,[],,,,,,,,,
Purple Heart Trail,Purple Heart,highway,,,,,,,,,,,,,,,,,,[],,,,,,,,,
Purple Heart Trail,Purple Heart,highway,,,,,,,,,,,,,,,,,,[],,,,,,,,,
James A. Rhodes Appalachian Highway,James A Rhodes Appalachian,highway,,,,,,,,,,,,,,,,,,[],,,,,,,,,
Veterans of Foreign Wars Memorial Highway,Veterans of Foreign Wars,highway,,,,,,,,,,,,,,,,,,[],,,,,,,,,
Christopher Columbus Highway,Christopher Columbus,highway,,,,,,,,,,,,,,,,,,[],,,,,,,,,
Disabled American Veterans' Highway,Disabled American Veterans,highway,,,,,,,,,,,,,,,,,,[],,,,,,,,,
Vietnam Veterans' of America Highway,Vietnam Veterans of America,highway,,,,,,,,,,,,,,,,,,[],,,,,,,,,
Marine Corps League Memorial Highway,Marine Corps League,highway,,,,,,,,,,,,,,,,,,[],,,,,,,,,
Tuskegee Airmen Memorial Trail,Tuskegee Airmen,highway,,,,,,,,,,,,,,,,,,[],,,,,,,,,
Ohio Medal of Honor Highway,Ohio Medal of Honor,highway,,,,,,,,,,,,,,,,,,[],,,,,,,,,
"American Gold Star Mothers, Inc. Memorial Highway",American Gold Star Mothers Inc,highway,,,,,,,,,,,,,,,,,,[],,,,,,,,,
Cpl. Jack O. McClure Memorial Highway,Cpl Jack O McClure,highway,,,,,,,,,,,,,,,,,,[],,,,,,,,,
"PFC Burt ""Rusty"" Miller Memorial Highway",PFC Burt Rusty Miller,highway,,,,,,,,,,,,,,,,,,[],,,,,,,,,
The Military Order of the Purple Heart Memorial Highway,The Military Order of the Purple Heart,highway,,,,,,,,,,,,,,,,,,[],,,,,,,,,
"Lance Corporal Daniel Nathan Deyarmin, Jr., Memorial Highway",Lance Corporal Daniel Nathan Deyarmin Jr,highway,,,,,,,,,,,,,,,,,,[],,,,,,,,,
Staff Sergeant Howard E. Woodford Medal of Honor Recipient Memorial Highway,Staff Sergeant Howard E Woodford Medal of Honor Recipient,highway,,,,,,,,,,,,,,,,,,[],,,,,,,,,
Second Lieutenant David E. Rylander Memorial Highway,Second Lieutenant David E Rylander,highway,,,,,,,,,,,,,,,,,,[],,,,,,,,,
Eighty-third Division Memorial Highway,Eightythird Division,highway,,,,,,,,,,,,,,,,,,[],,,,,,,,,
Gold Star Mothers' Memorial Highway,Gold Star Mothers,highway,,,,,,,,,,,,,,,,,,[],,,,,,,,,
"Army PFC Robert S. Sombati, Vietnam BSM and OLC PH, Memorial Highway",Army PFC Robert S Sombati Vietnam BSM and OLC PH,highway,,,,,,,,,,,,,,,,,,[],,,,,,,,,
Staff Sgt. Matthew J. Kuglics Memorial Highway,Staff Sgt Matthew J Kuglics,highway,,,,,,,,,,,,,,,,,,[],,,,,,,,,
Cliff Skeen Memorial Highway,Cliff Skeen,highway,,,,,,,,,,,,,,,,,,[],,,,,,,,,
Korean War Veterans' Memorial Highway,Korean War Veterans,highway,,,,,,,,,,,,,,,,,,[],,,,,,,,,
Sergeant Bryan W. Large Memorial Highway,Sergeant Bryan W Large,highway,,,,,,,,,,,,,,,,,,[],,,,,,,,,
Sergeant Justin T. Walsh Memorial Highway,Sergeant Justin T Walsh,highway,,,,,,,,,,,,,,,,,,[],,,,,,,,,
Sgt. 1st Class Daniel B. Crabtree Memorial Road,Sgt 1st Class Daniel B Crabtree,highway,,,,,,,,,,,,,,,,,,[],,,,,,,,,
Officer Justin Winebrenner Memorial Highway,Officer Justin Winebrenner,highway,,,,,,,,,,,,,,,,,,[],,,,,,,,,
Marine Gunnery Sgt. Robert L. Gilbert II Memorial Highway,Marine Gunnery Sgt Robert L Gilbert II,highway,,,,,,,,,,,,,,,,,,[],,,,,,,,,
Sergeant James F. Allen III Memorial Highway ,Sergeant James F Allen III Memorial Highway,highway,,,,,,,,,,,,,,,,,,[],,,,,,,,,
Army Pfc. Michael Dominic Paonessa Memorial Highway,Army Pfc Michael Dominic Paonessa,highway,,,,,,,,,,,,,,,,,,[],,,,,,,,,
"Lance Corporal Michael C. Spaulding, USMC, Memorial Highway",Lance Corporal Michael C Spaulding USMC,highway,,,,,,,,,,,,,,,,,,[],,,,,,,,,
Cpl. Andrew D. Brownfield Memorial Highway,Cpl Andrew D Brownfield,highway,,,,,,,,,,,,,,,,,,[],,,,,,,,,
Chief Radio Operator Walter Dawson Memorial Highway,Chief Radio Operator Walter Dawson,highway,,,,,,,,,,,,,,,,,,[],,,,,,,,,
Veterans Memorial Bridge,Veterans,highway,,,,,,,,,,,,,,,,,,[],,,,,,,,,
Hubbard First Responders Bridge,Hubbard First Responders,highway,,,,,,,,,,,,,,,,,,[],,,,,,,,,
Vienna Township Memorial Bridge,Vienna Township,highway,,,,,,,,,,,,,,,,,,[],,,,,,,,,
Cortland Veterans Memorial Bridge,Cortland Veterans,highway,,,,,,,,,,,,,,,,,,[],,,,,,,,,
Gold Star Mothers' Memorial Highway,Gold Star Mothers,highway,,,,,,,,,,,,,,,,,,[],,,,,,,,,
Lake to River Highway,Lake to River,highway,,,,,,,,,,,,,,,,,,[],,,,,,,,,
Sgt. Robert M. Carr Memorial Interchange,Sgt Robert M Carr,highway,,,,,,,,,,,,,,,,,,[],,,,,,,,,
Sgt. Marco Miller Memorial Interchange,Sgt Marco Miller,highway,,,,,,,,,,,,,,,,,,[],,,,,,,,,
Purple Heart Veterans Memorial Bridge,Purple Heart Veterans,highway,,,,,,,,,,,,,,,,,,[],,,,,,,,,
World War I and World War II Veterans Memorial Bridge,World War I and World War II Veterans,highway,,,,,,,,,,,,,,,,,,[],,,,,,,,,
Persian Gulf Veterans Bridge,Persian Gulf Veterans,highway,,,,,,,,,,,,,,,,,,[],,,,,,,,,
Iraq and Afghanistan Veterans Bridge,Iraq and Afghanistan Veterans,highway,,,,,,,,,,,,,,,,,,[],,,,,,,,,
Lance Corporal Stanley J. Sliwinski Memorial Highway,Lance Corporal Stanley J Sliwinski,highway,,,,,,,,,,,,,,,,,,[],,,,,,,,,
Sgt. Bruce R. Jones Memorial Bridge,Sgt Bruce R Jones,highway,,,,,,,,,,,,,,,,,,[],,,,,,,,,
"Virginia E. ""Ginny"" Kirsch Memorial Highway",Virginia E Ginny Kirsch,highway,,,,,,,,,,,,,,,,,,[],,,,,,,,,
Purple Heart Veterans Memorial Bridge,Purple Heart Veterans,highway,,,,,,,,,,,,,,,,,,[],,,,,,,,,
Patrolman James A. Fredericka Memorial Highway,Patrolman James A Fredericka,highway,,,,,,,,,,,,,,,,,,[],,,,,,,,,
Eighty-third Division Memorial Highway,Eightythird Division,highway,,,,,,,,,,,,,,,,,,[],,,,,,,,,
Army Corporal Keith Nepsa Memorial Highway,Army Corporal Keith Nepsa,highway,,,,,,,,,,,,,,,,,,[],,,,,,,,,
PFC Oscar F. Nicewander Memorial Highway,PFC Oscar F Nicewander,highway,,,,,,,,,,,,,,,,,,[],,,,,,,,,
Lance Corporal Peter James Clore Memorial Highway,Lance Corporal Peter James Clore,highway,,,,,,,,,,,,,,,,,,[],,,,,,,,,
William Green Memorial Highway,William Green,highway,,,,,,,,,,,,,,,,,,[],,,,,,,,,
Korean War Veterans' Memorial Highway,Korean War Veterans,highway,,,,,,,,,,,,,,,,,,[],,,,,,,,,
Sergeant Jeremy D. Barnett Memorial Highway,Sergeant Jeremy D Barnett,highway,,,,,,,,,,,,,,,,,,[],,,,,,,,,
Sgt. James L. Smith Memorial Highway,Sgt James L Smith,highway,,,,,,,,,,,,,,,,,,[],,,,,,,,,
Bill Hinig Memorial Highway,Bill Hinig,highway,,,,,,,,,,,,,,,,,,[],,,,,,,,,
Roberty E. Turney Memorial Highway,Roberty E Turney,highway,,,,,,,,,,,,,,,,,,[],,,,,,,,,
Specialist Ronald Gene Johnson Memorial Overpass,Specialist Ronald Gene Johnson,highway,,,,,,,,,,,,,,,,,,[],,,,,,,,,
Forty-second Rainbow Division Memorial Highway,Fortysecond Rainbow Division,highway,,,,,,,,,,,,,,,,,,[],,,,,,,,,
Wright Brothers Memorial Highway,Wright Brothers,highway,,,,,,,,,,,,,,,,,,[],,,,,,,,,
Marine Corps League memorial highway,Marine Corps League,highway,,,,,,,,,,,,,,,,,,[],,,,,,,,,
Johnny Appleseed Highway,Johnny Appleseed,highway,,,,,,,,,,,,,,,,,,[],,,,,,,,,
Van Wert County Veteran's Memorial Highway,Van Wert County Veterans,highway,,,,,,,,,,,,,,,,,,[],,,,,,,,,
Marine Corps League memorial highway,Marine Corps League,highway,,,,,,,,,,,,,,,,,,[],,,,,,,,,
Ryan Seitz Memorial Highway,Ryan Seitz,highway,,,,,,,,,,,,,,,,,,[],,,,,,,,,
George Washington Highway,George Washington,highway,,,,,,,,,,,,,,,,,,[],,,,,,,,,
Governor Robert Lucas Highway,Governor Robert Lucas,highway,,,,,,,,,,,,,,,,,,[],,,,,,,,,
Warren County Veterans Highway,Warren County Veterans,highway,,,,,,,,,,,,,,,,,,[],,,,,,,,,
Thirty-seventh Division Memorial Highway,Thirtyseventh Division,highway,,,,,,,,,,,,,,,,,,[],,,,,,,,,
Forty-second Rainbow Division Memorial Highway,Fortysecond Rainbow Division,highway,,,,,,,,,,,,,,,,,,[],,,,,,,,,
General Duncan McArthur Highway,General Duncan McArthur,highway,,,,,,,,,,,,,,,,,,[],,,,,,,,,
