OBJECTID,COUNTY,COUNTY_ID,DESIGNATIO,DESCRIPTIO,HWY_NAME,BILL,DEDICATED,EFFECTIVE_,District,Local_Name,BILL_URL,CreationDa,Creator,EditDate,Editor,MemId,Shape_Leng,LOCAL_RES,GlobalID,Shape__Length,BILL_DESCRIPTION,BILL_YEAR,wikipedia_url_sam,Does_Sam_Think_is_real,dob_sam,status,match_confidence,validated,validation_notes,summary,education,dod_sam,place_of_birth,place_of_death,gender_sam,involved_in_sports,involved_in_politics,involved_in_military,involved_in_music,Matched Name,dept_url,url,name,age,tour,badge,cause,weapon,incident_description,bio_section_raw,incident_details_raw,Clean_Name,Primary Occupation,Race,Sex,Birth Date,Death Date,Wikipedia Link,Noah_Thinks_is_Real
1399,Miami‐Dade,87.0,Estrella Rubio Way,"That portion of LeJeune Road/S.W. 42nd Avenue between S.W. 8th Street and Coral Way in Miami-Dade County is designated as ""Estrella Rubio Way.""",,CS/SB 138,2007/07/01 05:00:00+00,2007.0,6.0,LeJeune Road,,,,,,715.0,,0.0,1c8d5ea6-06f9-4a90-ad29-aed50e400a95,1866.41336333561,,,https://en.wikipedia.org/wiki/Hulk_Hogan,no,1953-08-11,Found,47.0,True,seq=3.3; last-mismatch:-4; human:+40; fl:+10; county-miss:-8; us:+5,"Hulk Hogan, born Terry Gene Bollea on August 11, 1953, is an American retired professional wrestler, actor, and television personality. He rose to fame in the 1980s as the face of the World Wrestling Federation (WWF, now WWE), becoming one of the most iconic figures in wrestling history. Known for his charismatic persona and signature red-and-yellow bandana, Hogan won multiple championships, including six WWF/WWE World Heavyweight titles. His cultural impact extended beyond wrestling into mainstream entertainment, making him a global pop culture symbol of the era.","['University of South Florida', 'Hillsborough Community College', 'Robinson High School']",,"Augusta, Georgia, United States",not found,male,yes,no,no,yes,,,,,,,,,,,,,,,,,,,,
1400,Miami‐Dade,87.0,Ethel Beckford Boulevard,"That portion of S.W. 186th Street between U.S. Highway 1 and S.W. 107th Avenue in Miami-Dade County is designated as ""Ethel Beckford Boulevard.""",,CS/SB 1958,2003/06/10 05:00:00+00,2003.0,6.0,S.W. 186th Street,,,,,,716.0,,0.0,36a5277d-af2f-4898-981f-995e99573143,1014.91463146793,,,https://en.wikipedia.org/wiki/Lucinda_Bragg_Adams,no,1812-01-01,Found,27.1,True,seq=6.1; last-mismatch:-4; human:+40; fl-miss:-10; county-miss:-8; us:+5,"Lucinda Bragg Adams was born in 1812 and lived through the 19th century, though her exact death date remains unclear. She was the second wife of U.S. President John Quincy Adams, marrying him in 1829 after the death of his first wife, Louisa. Adams is primarily remembered for her brief and largely undocumented role in the Adams family during the later years of John Quincy Adams' political career. Her historical significance is tied to her association with the Adams political dynasty rather than independent achievements.",,,not found,not found,female,no,no,no,no,,,,,,,,,,,,,,,,,,,,
1401,Miami‐Dade,87.0,Father Gerard Jean‐Juste Street,"That portion of N.W. 54th Street in Miami-Dade County between N.W. 2nd Avenue and N.E. 3rd Avenue in Little Haiti is designated as ""Father Gerard Jean-Juste Street.""",,CS/HB 7039,2012/07/01 05:00:00+00,2012.0,6.0,N.W. 54th Street,,,,,,717.0,,0.0,ff3bfb65-b2f9-49de-8d91-6b5e5c89f983,1170.15213308568,,,https://en.wikipedia.org/wiki/G%C3%A9rard_Jean-Juste,yes,1946-02-07,Found,60.6,True,seq=14.6; human:+40; fl:+10; county-miss:-8,"Gérard Jean-Juste was a Haitian Roman Catholic priest and prominent political activist born on February 7, 1946. Known for his advocacy for democracy and human rights, he became a vocal opponent of Haiti's authoritarian regimes, including the Latortue government. Jean-Juste founded the Miami-based Haitian Refugee Center to support refugees fleeing political persecution and later returned to Haiti to continue his activism. He died on May 27, 2009, in Miami, Florida, after battling leukemia, leaving a legacy as a champion for social justice in Haiti.","['Seminary studies (Roman Catholic priesthood)', 'University of Haiti (studied theology and philosophy)']",2009-05-27,"Cavaillon, Sud, Haiti","Miami, Florida, United States",male,no,yes,no,no,,,,,,,,,,,,,,,,,,,,
1409,Miami‐Dade,87.0,Henri Levy Boulevard,"That portion of 71st Street between Collins Avenue and Bay Drive in the City of Miami Beach in Miami-Dade County is designated as ""Henri Levy Boulevard.""",,CS/SB 1604,2008/07/01 05:00:00+00,2008.0,6.0,71st Street,,,,,,725.0,,0.0,356e9a37-4099-4684-a141-b78c86911b8e,830.457977990049,,,https://en.wikipedia.org/wiki/Henri_Michel-L%C3%A9vy,no,1844-01-01,Found,37.3,True,seq=13.3; last-mismatch:-4; human:+40; fl-miss:-10; county-miss:-8,"Henri Michel-Lévy was a French painter born in 1844, known for his contributions to the Impressionist movement. He specialized in landscapes and urban scenes, capturing the essence of Parisian life during the late 19th century. His works were exhibited at the Salon des Artistes Français and other prominent venues. Michel-Lévy passed away in 1914, leaving behind a legacy of vibrant, atmospheric paintings that reflected his era.",,1914-01-01,not found,not found,male,no,no,no,no,,,,,,,,,,,,,Henri Levy,rabbi,,male,1883-06-07,1942-08-13,https://de.wikipedia.org/wiki/Henri_L%C3%A9vy_(Rabbiner),False
1410,Miami‐Dade,87.0,Herbert Lee Simon Avenue,"That portion of S.W. 27th Avenue (S.R. 9) between S.W. 22nd Street and U.S. 1 in the City of Miami in Miami-Dade County is designated as ""Herbert Lee Simon Avenue.""",SR-9,HB 5,2010/07/01 05:00:00+00,2010.0,6.0,S.W. 27th Avenue,,,,,,726.0,,1.0,93863ae5-e400-4bbe-aec6-f9f193da2cad,1279.60615687146,,,,,,,,,,,,,,,,,,,,,,,,,,,,,,,,,,,,,,,
1412,Miami‐Dade,87.0,"Honorable Robert B. Ingram, Ph.D., Boulevard","The portion of Opa-Locka Boulevard/N.W. 135th Street in Miami-Dade County between N.W. 7th Avenue and N.W. 47th Avenue is designated as ""Honorable Robert B. Ingram, Ph.D., Boulevard.""",,CS/SB 1604,2008/07/01 05:00:00+00,2008.0,6.0,Opa‐Locka Boulevard,,,,,,728.0,,0.0,353feec5-4bfe-4c10-bb7f-c79f1dc75650,7161.41867809513,W. 24th Avenue and S.W. 27th Avenue in Miami-Dade County is designated as “Manuel Capo Boulevard. W. 24th Avenue and S.W. 27th Avenue in Miami-Dade County is desinged as “Manuel Capo Boulevard.,2010.0,https://en.wikipedia.org/wiki/Cesar_Chavez,no,1927-03-31,Found,27.0,True,seq=2.7; last-mismatch:-4; human:+40; fl-miss:-10; county-miss:-8; us:+5,"Cesar Chavez was born on March 31, 1927, in Yuma, Arizona, USA, and died on April 23, 1993. He was a prominent American labor leader and civil rights activist who co-founded the United Farm Workers (UFW) union with Dolores Huerta. Chavez became a leading voice for farmworkers' rights, advocating for better wages, working conditions, and dignity through nonviolent protests like boycotts and strikes. His legacy endures as a symbol of social justice and grassroots organizing in the United States.","['Multiple local schools in Arizona and California (elementary, due to migrant lifestyle)', 'No formal higher education']",1993-04-23,"Yuma, Arizona, United States","San Luis, Arizona, United States",male,no,yes,yes,no,,,,,,,,,,,,,,,,,,,,
1415,Miami‐Dade,87.0,Jacob Fleishman Street,"That portion of S.R. 934/N.W. 79th Street between N.W. 14th Avenue and N.W. 9th Avenue in Miami-Dade County is designated as ""Jacob Fleishman Street.""",,CS/HB 7039,2012/07/01 05:00:00+00,2012.0,6.0,NW 79th St,,,,,,731.0,,1.0,d2a8c42a-e219-49b2-aa29-2dc1532431fb,1020.14820276118,,,https://en.wikipedia.org/wiki/Josh_Radnor,no,1974-07-29,Found,30.2,True,seq=9.2; last-mismatch:-4; human:+40; fl-miss:-10; county-miss:-8; us:+5,"Josh Radnor is an American actor, director, and musician born on July 29, 1974. He is best known for his role as Ted Mosby in the long-running CBS sitcom How I Met Your Mother (2005–2014), which earned him widespread recognition. Radnor has also directed and starred in independent films like Happythankyoumoreplease (2010) and Liberal Arts (2012), showcasing his versatility beyond acting. Beyond television and film, he is involved in music, performing as part of the folk-rock duo Radnor & Lee.","['Kenyon College, Gambier, Ohio', 'Bachelor of Arts in Drama', 'New York University, Tisch School of the Arts', 'Master of Fine Arts in Acting']",,"Columbus, Ohio, United States",not found,male,no,no,no,yes,,,,,,,,,,,,,,,,,,,,
1416,Miami‐Dade,87.0,James Weldon Johnson Boulevard,"That portion of S.R. 932 on N.W. 103rd Street in Miami-Dade County, from the west boundary of State House District 108 to N.E. 6th Avenue, is designated as ""James Weldon Johnson Boulevard.""",,HB 9,2004/05/13 05:00:00+00,2004.0,6.0,N.W. 103rd Street,,,,,,732.0,,0.0,f88df228-2e19-45d2-97b4-0bd10bb8bc4d,4521.03294300991,,,Not Found,no,,Not Found,21.8,False,seq=17.8; last-mismatch:-4; fl:+10; county-miss:-8,,,,,,,,,,,,,,,,,,,,,,,James Weldon Johnson,writer,African Americans,male,1871-06-17,1938-06-26,https://en.wikipedia.org/wiki/James_Weldon_Johnson,True
1417,Miami‐Dade,87.0,Jean‐Jacques Dessalines Boulevard,"That portion of S.R. 922 on N.W. 125th Street in Miami-Dade County, from N.W. 7th Avenue to Griffing Boulevard, is designated as ""Jean-Jacques Dessalines Boulevard.""",,HB 9,2004/05/13 05:00:00+00,2004.0,6.0,N.W. 125th Street,,,,,,733.0,,0.0,b7e91054-4457-46e3-9c71-da14deede8f9,901.997412479561,,,https://en.wikipedia.org/wiki/Jean-Jacques_Dessalines,yes,1758-01-01,Found,42.0,True,seq=19.1; human:+40; fl-miss:-10; county-miss:-8,"Jean-Jacques Dessalines was born around 1758 in Saint-Domingue (modern-day Haiti) and died on 1806-10-17. He was a key leader in the Haitian Revolution, which successfully ended slavery and French colonial rule in Haiti. As a military commander and later Emperor of Haiti (1804–1806), he declared Haiti's independence on 1804-01-01, making it the first Black-led republic in the world. His leadership and policies were pivotal in shaping Haiti's early history and identity as a free nation.",,1806-10-17,"Saint-Domingue, Haiti","Pont-Rouge, Port-au-Prince, Haiti",male,no,yes,yes,no,,,,,,,,,,,,,,,,,,,,
1418,Miami‐Dade,87.0,Jean Baptiste Point du Sable Boulevard,"That portion of S.R. 934 on N.W. 79th Street between I-95 and N.E. 10th Avenue in Miami-Dade County is designated as ""Jean Baptiste Point du Sable Boulevard.""",,HB 385,2005/07/01 05:00:00+00,2005.0,6.0,N.W. 79th Street,,,,,,734.0,,0.0,b5e6da90-8039-4484-99d2-04018dc2312b,3531.29692397591,,,,,,,,,,,,,,,,,,,,,,,,,,,,,,,,Jean Baptiste Point du Sable,merchant,,male,1745-01-01,1818-08-28,https://en.wikipedia.org/wiki/Jean_Baptiste_Point_du_Sable,True
1424,Miami‐Dade,87.0,John H. Levi Highway,"That portion of S.R. A1A where it intersects the city limits of Miami Beach on Collins Avenue to the MacArthur Causeway in Miami-Dade County, Florida is designated as ""John H. Levi Highway.""",,15002,1931/04/14 05:00:00+00,1931.0,6.0,Collins Avenue,,,,,,740.0,,0.0,79abb27d-746c-4c73-a636-66a2612c1974,13438.6645289034,,,Not Found,no,,Not Found,7.0,False,seq=18.3; fl-miss:-10; county-miss:-8; us:+5,,,,,,,,,,,,,,,,,,,,,,,,,,,,,,
1426,Miami‐Dade,87.0,"John J. Brunettie, Sr., Avenue","That portion of E. 4th Avenue between 21st Street and 25th Street in Miami-Dade County is designated as ""John J. Brunetti, Sr., Avenue.""",,CS/SB 382,2018/07/01 05:00:00+00,2018.0,6.0,E. 4th Avenue,,,,,,742.0,,1.0,7e5e9638-5659-42bc-a80d-36f159ab21e5,449.291841632654,,,Not Found,no,,Not Found,0.0,False,no-candidates,,,,,,,,,,,,,,,,,,,,,,,,,,,,,,
1430,Miami‐Dade,87.0,Jose Regueiro Avenue,"That portion of W. 20th Avenue in the City of Hialeah between 44th Place and Okeechobee Road in Miami-Dade County is designated as ""Jose Regueiro Avenue.""",,HB 5,2010/07/01 05:00:00+00,2010.0,6.0,West 20th Avenue,,,,,,746.0,,1.0,b26eebda-cfae-4603-9c09-365bbec89474,1256.71606174038,,,,,,,,,,,,,,,,,,,,,,,,,,,,,,,,,,,,,,,
1431,Miami‐Dade,87.0,Joseph Emmanuel 'Manno' Charlemagne Street,"That portion of 5th street between Eculid Avenue and Lenox Avenue in Miami-Dade County is designated as ""Joseph Emmanuel 'Manno' Charlemagne Street.""",,CS/SB 382,2018/07/01 05:00:00+00,2018.0,6.0,5th Street,,,,,,747.0,,0.0,659a42ac-ac3e-4ea6-94b3-5a1614387089,507.566988079125,,,,,,,,,,,,,,,,,,,,,,,,,,,,,,,,,,,,,,,
1433,Miami‐Dade,87.0,"Judge Wilkie D. Ferguson, Jr. Boulevard","That portion of Honey Hill Drive in Miami-Dade County, from N.W. 27th Avenue to N.W. 47th Avenue is designated as ""Judge Wilkie D. Ferguson, Jr. Boulevard.""",,HB 9,2004/05/13 05:00:00+00,2004.0,6.0,Honey Hill Drive,,,,,,749.0,,0.0,06c70e22-2c71-42c3-8e53-20ddebce56e9,3600.23033144529,,,https://en.wikipedia.org/wiki/Albert_Tresvant,no,1935-01-01,Found,47.1,True,seq=6.1; last-mismatch:-4; human:+40; fl:+10; county-miss:-8; us:+5,"Albert Tresvant was an American politician and civil rights activist born in 1935. He served as a member of the Illinois House of Representatives from 1973 to 1993, representing the 26th district. Tresvant was known for his advocacy in education reform and community development initiatives in Chicago. His career spanned several decades, leaving a lasting impact on local politics and social justice efforts.",,,"Chicago, Illinois, United States",not found,male,no,yes,no,no,,,,,,,,,,,,,,,,,,,,
1436,Miami‐Dade,87.0,Julia Tuttle Way,"That portion of Biscayne Boulevard Way between S.E. 2nd Avenue and U.S. 1 in Miami-Dade County is designated as ""Julia Tuttle Way.""",,HB 5,2010/07/01 05:00:00+00,2010.0,6.0,Biscayne Boulevard Way,,,,,,752.0,,1.0,727b7d06-2ef0-4992-a85e-0a5c38bdf838,418.417927194972,That portion of Northeast Sixth Avenue between Northeast 113th and 121st Street in Miami-Dade County is designated as “Biscayne Park Way.,2010.0,https://en.wikipedia.org/wiki/Julia_Tuttle,yes,1849-01-22,Found,67.0,True,seq=20.0; human:+40; fl:+10; county-miss:-8; us:+5,"Julia Tuttle was an American businesswoman and landowner born on January 22, 1849, in Cleveland, Ohio. She is best known as the 'Mother of Miami' for convincing railroad tycoon Henry Flagler to extend his Florida East Coast Railway to the area, leading to the city's founding in 1896. Tuttle owned significant land in South Florida and played a pivotal role in its early development by donating property for infrastructure and public use. She died on September 14, 1898, in Miami, Florida, shortly after the city's incorporation and during a yellow fever epidemic.","['Cleveland public schools (primary education)', 'Seminary education (likely in Ohio, exact institution unknown)']",1898-09-14,"Cleveland, Ohio, United States","Miami, Florida, United States",female,no,yes,no,no,,,,,,,,,,,,,Julia Tuttle,businessperson,,female,1849-01-22,1898-09-14,https://en.wikipedia.org/wiki/Julia_Tuttle,True
1438,Miami‐Dade,87.0,Le Jeune State Historic Road,"That portion of Le Jeune Road within the city limits of the City of Coral Gables and the City of Miami and between U.S. Highway 1 and Cartagena Plaza is designated as the ""Le Jeune State Historic Road.""",,HB 325,2002/05/01 05:00:00+00,2002.0,6.0,S.W. 42nd Avenue,,,,,,754.0,,0.0,dfbd8fc1-0d8b-4cf0-99d8-ea7d8ae6e7fb,10880.0507842707,,,,,,,,,,,,,,,,,,,,,,,,,,,,,,,,Le Jeune,,,,,,https://commons.wikimedia.org/wiki/Category:Le_Jeune_(surname),False
1445,Miami‐Dade,87.0,Maestro Luis Casas Romero Way,"That portion of S.R. 968, or Flagler Street, which lies between 14th Avenue S.W. and 16th Avenue S.W. in the City of Miami, is designated as ""Maestro Luis Casas Romero Way.""",,SB 26,1996/05/07 05:00:00+00,1996.0,6.0,Flagler Street,,,,,,761.0,,0.0,406e0200-d2df-4690-99e2-1b1ae1808200,372.770613928622,S.W. 22nd Avenue between Kirk Street and Tigertail Avenue in Miami-Dade County as “Mama Elsa Street.,2023.0,https://en.wikipedia.org/wiki/Curro_Romero,no,1933-12-01,Found,35.7,True,seq=9.7; human:+40; fl-miss:-10; county-miss:-8,"Curro Romero was a legendary Spanish bullfighter born on December 1, 1933, in Camas, Spain. Known for his elegant and artistic style in the bullring, he became one of the most celebrated matadors of the 20th century, achieving fame during the 1960s and 1970s. His career spanned several decades, earning him a reputation as a master of the faena (bullfighting performance) and a cultural icon in Spain. Romero passed away on May 13, 2024, leaving behind a lasting legacy in the world of bullfighting.",,2024-05-13,"Camas, Andalusia, Spain",not found,male,yes,no,no,no,,,,,,,,,,,,,,,,,,,,
1447,Miami‐Dade,87.0,Manolo Reyes Way,"That portion of S.W. 3rd Avenue from 26th Road to 27th Road in Miami is designated as ""Manolo Reyes Way.""",,CS/SB 1392,1994/04/08 05:00:00+00,1994.0,6.0,S.W. 3rd Avenue,,,,,,763.0,,0.0,94ff29b6-b725-48c1-b438-889bd4dfe5f6,115.998816834453,,,https://en.wikipedia.org/wiki/Manolo_Reyes,yes,1956-11-19,Found,67.0,True,seq=20.0; human:+40; fl:+10; county-miss:-8; us:+5,"Manolo Reyes was a Spanish actor and comedian born on November 19, 1956, in Madrid, Spain. He gained fame for his roles in Spanish television and film, particularly in comedic productions during the 1980s and 1990s. Reyes was part of the iconic Spanish comedy group Martes y Trece alongside Millán Salcedo and José Luis López Vázquez. He passed away on June 1, 2023, leaving behind a legacy as one of Spain’s beloved comedic actors.",,2023-06-01,"Madrid, Spain","Madrid, Spain",male,no,no,no,no,,,,,,,,,,,,,Manolo Reyes,journalist,,male,1924-07-29,2008-01-03,https://en.wikipedia.org/wiki/Manolo_Reyes,True
1449,Miami‐Dade,87.0,Manuel Capo Way,"That portion of S.W. 88th Street between S.W. 137th Avenue and S.W. 142nd Avenue in Miami-Dade County is designated as ""Manuel Capo Way.""",,HB 5,2010/07/01 05:00:00+00,2010.0,6.0,S.W. 88th Street,,,,,,765.0,,1.0,070c026e-7310-475f-a046-6f963bea7b7b,933.387977255202,,,https://en.wikipedia.org/wiki/Carlos_Lehder,no,1949-09-07,Found,47.0,True,seq=5.0; last-mismatch:-4; human:+40; fl:+10; county-miss:-8; us:+5,"Carlos Lehder was born on September 7, 1949, in Armenia, Colombia, and became one of the most notorious drug traffickers of the Medellín Cartel. He co-founded the cartel alongside Pablo Escobar and played a pivotal role in smuggling cocaine into the United States during the 1970s and 1980s. Lehder was captured in 1987, extradited to the U.S., and sentenced to life imprisonment, though his sentence was later reduced. His criminal empire and extravagant lifestyle made him a key figure in the global drug trade during the late 20th century.",,,"Armenia, Quindío, Colombia",not found,male,no,no,no,no,,,,,,,,,,,,,,,,,,,,
1451,Miami‐Dade,87.0,Marjory Stoneman Douglas Sunset Drive,"That portion of S.W. 72nd Street from S.W. 42nd Avenue to S.W. 157th Avenue in Miami-Dade County is desiganted as ""Marjory Stoneman Douglas Sunset Drive.""",,SB 1156,1996/05/07 05:00:00+00,1996.0,6.0,S.W. 72nd Street,,,,,,767.0,,0.0,f064b017-638b-4df3-9b9c-967261df8e17,20654.5929542641,,,https://en.wikipedia.org/wiki/Karamo_Brown,no,1980-11-02,Found,47.0,True,seq=5.6; last-mismatch:-4; human:+40; fl:+10; county-miss:-8; us:+5,"Karamo Brown is an American television host, reality TV personality, and activist born on November 2, 1980. He is best known as the culture expert on the Netflix reboot of Queer Eye, which earned him widespread recognition and acclaim. Brown began his career in social work and media, appearing on MTV’s The Real World: Philadelphia in 2004 before transitioning into advocacy and entertainment. His work spans television, activism for LGBTQ+ rights, and mental health awareness, making him a prominent cultural figure in modern media.","['Florida A&M University', ""Bachelor's degree in Psychology"", 'University of Southern California', ""Master's degree in Social Work""]",,"Houston, Texas, United States of America",not found,male,no,yes,no,no,,,,,,,,,,,,,Marjory Stoneman Douglas,journalist,,female,1890-04-07,1998-05-14,https://en.wikipedia.org/wiki/Marjory_Stoneman_Douglas,True
1452,Miami‐Dade,87.0,Marlins Expressway,"The Gratigny Parkway (S.R. 924) is designated as the ""Marlins Expressway.""",,CS/SB 1014,1998/05/22 05:00:00+00,1998.0,6.0,Gratigny Parkway,,,,,,768.0,,0.0,42cd9d9c-bca7-4324-9875-d4b1b931cfdd,16155.4589709922,That portion of Northeast Sixth Avenue between Northeast 113th and 121st Street in Miami-Dade County is designated as “Biscayne Park Way.,2010.0,,,,,,,,,,,,,,,,,,,,,,,,,,,,,,Marlins,,,,,,https://en.wikipedia.org/wiki/Miami_Marlins,True
1454,Miami‐Dade,87.0,Mary Ellen Miller Way,"That portion of Hialeah Drive between Okeechobee Road and LeJeune Road in Miami-Dade County is designated as ""Mary Ellen Miller Way.""",,CS/SB 1604,2008/07/01 05:00:00+00,2008.0,6.0,Hialeah Drive,,,,,,770.0,,0.0,d5ea1319-83e8-45b0-b8a7-8fefccb0bf8e,1682.40164566209,,,Not Found,no,,Not Found,18.2,False,seq=12.2; fl:+10; county-miss:-8,,,,,,,,,,,,,,,,,,,,,,,,,,,,,,
1456,Miami‐Dade,87.0,Mayor General Ignacio Agramonte y Loynaz Roadway,"That portion of West Flagler Street from S.W. 27th Avenue to S.W. 42nd Avenue is designated as the ""Mayor General Ignacio Agramonte y Loynaz Roadway.""",,CS/HB 75,1994/03/28 05:00:00+00,1994.0,6.0,West Flagler Street,,,,,,772.0,,0.0,c36d4ccb-4434-44b2-9f95-6cd472670cf9,2735.72798010432,R. 423/John Young Parkway and C.R. 526/Crystal Lake Drive in Orange County is designated as “Bessie Coleman Street.,2014.0,,,,,,,,,,,,,,,,,,,,,,,,,,,,,,,,,,,,,
1463,Miami‐Dade,87.0,Natan R. Rok Boulevard,"That portion of East Flagler Street from North Miami Avenue to N.E. 2nd Avenue in Miami, Florida, is designated as ""Natan R. Rok Boulevard.""",,CS/HB 55,1990/06/22 05:00:00+00,1990.0,6.0,East Flagler Street,,,,,,779.0,,0.0,781b4755-57d1-4e54-998b-9c35d4d62fd4,371.448826697106,R. 423/John Young Parkway and C.R. 526/Crystal Lake Drive in Orange County is designated as “Bessie Coleman Street.,2014.0,Not Found,no,,Not Found,0.0,False,seq=1.9; last-mismatch:-4; fl-miss:-10; county-miss:-8,,,,,,,,,,,,,,,,,,,,,,,,,,,,,,
1468,Miami‐Dade,87.0,Orange Bowl Way,"That portion of N.W. 77th Court in Miami Lakes is designated as ""Orange Bowl Way.""",,HB 5,2010/07/01 05:00:00+00,2010.0,6.0,N.W. 77th Court,,,,,,784.0,,1.0,78263f73-35fd-4211-842d-544657fa298b,4170.47504771866,,,https://en.wikipedia.org/wiki/Anita_Bryant,no,1940-03-25,Found,43.0,True,seq=7.0; last-mismatch:-4; human:+40; fl:+10; county-miss:-8,"Anita Bryant was an American singer, beauty pageant winner, and conservative activist born on March 25, 1940. She rose to fame in the 1950s–1960s as a pop singer and commercial spokesperson, notably for the Florida Citrus Commission. Bryant became a polarizing figure in the 1970s for her high-profile anti-gay rights campaign, which led to both victories and backlash. She passed away on June 23, 2024, leaving behind a complex legacy tied to her music career and political activism.",,2024-06-23,"Barnsdall, Oklahoma, United States",not found,female,no,yes,no,yes,,,,,,,,,,,,,Orange Bowl,,,,,,https://en.wikipedia.org/wiki/Orange_Bowl,True
1473,Miami‐Dade,87.0,Pinecrest Parkway,"That portion of S.R. 5 (South Dixie Highway) within the municipal limits of the Village of Pinecrest in Miami-Dade County is designated as the ""Pinecrest Parkway.""",,CS/SB 82,1999/06/11 05:00:00+00,1999.0,6.0,South Dixie Highway,,,,,,789.0,,0.0,93044f80-92b4-4dc4-9c6e-a676c64ce9d0,6801.64291697193,,,,,,,,,,,,,,,,,,,,,,,,,,,,,,,,Pinecrest,,,,,,"https://en.wikipedia.org/wiki/Pinecrest,_Florida",True
1475,Miami‐Dade,87.0,Rafael Diaz-Balart Way,"That portion of LeJeune Road between East 65th Street and Okeechobee Road in the City of Hialeah in Miami-Dade County is designated as ""Rafael Diaz-Balart Way.""",,CS/SB 1604,2008/07/01 05:00:00+00,2008.0,6.0,LeJeune Rd/SE 8th Ave,,,,,,791.0,,0.0,0cb28c23-6482-43ab-8f3e-967299666e7e,8807.98263547005,,,https://en.wikipedia.org/wiki/Mario_D%C3%ADaz-Balart,no,1961-09-25,Found,64.7,True,seq=13.7; human:+40; fl:+10; county-miss:-8; us:+5,"Mario Díaz-Balart is a Cuban-American politician born on September 25, 1961, in Fort Lauderdale, Florida. He has served as a U.S. Representative for Florida's 25th (2003–2011) and 26th (2013–present) congressional districts, known for his conservative stance and advocacy on Cuban-American issues. Prior to his federal career, he was a member of the Florida House of Representatives (1988–1992) and the Florida Senate (1992–2000). Díaz-Balart remains an influential figure in U.S. politics, particularly in foreign policy debates concerning Latin America and Cuba.","['University of South Florida, Bachelor of Arts (Political Science)', 'Florida International University, Master of Public Administration']",,"Fort Lauderdale, Florida, United States",not found,male,no,yes,no,no,,,,,,,,,,,,,Rafael Diaz-Balart,politician,,male,1926-01-17,2005-05-06,https://en.wikipedia.org/wiki/Rafael_D%C3%ADaz-Balart,True
1484,Miami‐Dade,87.0,Ricardo Karakadze Street,"The portion of 104th Street between U.S. 1 and 97th Avenue is designated as the ""Ricardo Karakadze Street.""",,HB 385,2005/07/01 05:00:00+00,2005.0,6.0,104th Street,,,,,,800.0,,0.0,cf10d4da-5991-4241-bccf-f5564a77fdbb,3478.98545660392,,,Not Found,no,,Not Found,0.0,False,no-candidates,,,,,,,,,,,,,,,,,,,,,,,,,,,,,,
1494,Miami‐Dade,87.0,S.W. 62nd Avenue Historic Highway,"That portion of S.W. 62nd Avenue between S.W. 8th Street and Coral Way (S.W. 24th Street) is designated as ""S.W. 62nd Avenue Historic Highway.""",,CS/SB 512,1993/04/01 05:00:00+00,1993.0,6.0,S.W. 62nd Avenue,,,,,,810.0,,0.0,ca70c720-44bf-4489-8661-6d036b1ad6e0,1892.034857148,,,,,,,,,,,,,,,,,,,,,,,,,,,,,,,,,,,,,,,
1498,Miami‐Dade,87.0,Shawn O'Dare Way,"That portion of N.W. 167th Street between N.W. 57th Avenue and N.W. 67th Avenue in the Town of Miami Lakes in Miami-Dade County is designated as ""Shawn O'Dare Way.""",,HB 385,2005/07/01 05:00:00+00,2005.0,6.0,N.W. 167th Street,,,,,,814.0,,0.0,45741968-85d4-4824-96f1-d4aa5ad2bc1f,1767.65418838938,,,Not Found,no,,Not Found,0.0,False,seq=3.4; last-mismatch:-4; fl-miss:-10; county-miss:-8,,,,,,,,,,,,,,,,,,,,,,,,,,,,,,
