OBJECTID,COUNTY,COUNTY_ID,DESIGNATIO,DESCRIPTIO,HWY_NAME,BILL,DEDICATED,EFFECTIVE_,District,Local_Name,BILL_URL,CreationDa,Creator,EditDate,Editor,MemId,Shape_Leng,LOCAL_RES,GlobalID,Shape__Length,BILL_DESCRIPTION,BILL_YEAR,wikipedia_url_sam,Does_Sam_Think_is_real,dob_sam,status,match_confidence,validated,validation_notes,summary,education,dod_sam,place_of_birth,place_of_death,gender_sam,involved_in_sports,involved_in_politics,involved_in_military,involved_in_music,Matched Name,dept_url,url,name,age,tour,badge,cause,weapon,incident_description,bio_section_raw,incident_details_raw,Clean_Name,Primary Occupation,Race,Sex,Birth Date,Death Date,Wikipedia Link,Noah_Thinks_is_Real
182,Pinellas,15.0,Purple Heart Trail,"That portion of S.R. 60 between the Hillsborough County line and Mandalay Avenue in Pinellas County is designated as ""Purple Heart Trail.""",SR-60,CS/CS/SB 368,2017/07/01 05:00:00+00,2017.0,7.0,Causeway Boulevard,,,,,,180.0,,0.0,341ecb6d-9b14-477f-bd1f-7eb63895ee5e,20836.1568010076,That portion of State Road 397 from Government Avenue to the North gate of Eglin Air Force Base in Okaloosa County is designated as “Colonel Bud Day Boulevard.,2010.0,,,,,,,,,,,,,,,,,,,,,,,,,,,,,,Purple Heart,,,,,,https://en.wikipedia.org/wiki/Purple_Heart,True
239,Charlotte,1.0,Albert W. Gilchrist Bridge,"A bridge being constructed in Charlotte County which will span the Peace River, is designated as the ""Albert W. Gilchrist Bridge.""",US-41,SB 606,1976/05/28 05:00:00+00,1976.0,1.0,,,,,,,181.0,,0.0,dd133a5d-7004-431d-bd32-3cd6ba19c5d3,2188.96998421575,,,https://en.wikipedia.org/wiki/Albert_W._Gilchrist,yes,1858-01-15,Found,67.0,True,seq=20.0; human:+40; fl:+10; county-miss:-8; us:+5,"Albert Wallach Gilchrist was an American politician born on January 15, 1858, in Charleston, South Carolina. He served as the 20th Governor of Florida from 1909 to 1913, marking his most notable political achievement. Gilchrist was also a lawyer and Confederate veteran, having fought in the Civil War during his youth. He passed away on May 15, 1926, leaving a legacy in Florida’s early 20th-century political history.","['University of Virginia (attended)', 'Read law under Judge William B. Gary (self-study)']",1926-05-15,"Charleston, South Carolina, United States","Gainesville, Florida, United States",male,no,yes,yes,no,,,,,,,,,,,,,Albert W. Gilchrist,politician,,male,1858-01-15,1926-05-15,https://en.wikipedia.org/wiki/Albert_W._Gilchrist,True
246,DeSoto,4.0,S. Chesterfield Smith Bridge,"The bridge over the Peace River on S.R. 70 in DeSoto County near Arcadia is designated as the ""S. Chesterfield Smith Bridge.""",SR-70,SB 1235,1961/06/22 05:00:00+00,1961.0,1.0,,,,,,,188.0,,0.0,6c8f25a7-3c42-4512-9d95-2de7f6ea7ad7,94.0796036980528,,,Not Found,no,,Not Found,7.0,False,seq=18.5; fl-miss:-10; county-miss:-8; us:+5,,,,,,,,,,,,,,,,,,,,,,,S. Chesterfield Smith,politician,,male,1896-01-13,,https://en.wikipedia.org/wiki/S._Chesterfield_Smith,True
247,Glades,5.0,Mamie Langdale Memorial Bridge,"The new U.S. Highway 27 bridge in the city of Moore Haven in Glades County is designated as ""Mamie Langdale Memorial Bridge.""",,CS/SB 676,2003/07/14 05:00:00+00,2003.0,1.0,,,,,,,189.0,,0.0,e08fdaae-01f4-4c2c-a80a-c4a101b55334,796.155325017408,,,Not Found,no,,Not Found,24.1,False,seq=7.1; last-mismatch:-4; fl:+10; county:+8; us:+5,,,,,,,,,,,,,,,,,,,,,,,,,,,,,,
248,Highlands,9.0,Purple Heart Memorial Highway,"That portion of U.S. Highway 27 that lies within Highlands County is designated as ""Purple Heart Memorial Highway.""",US-27,HB 385,2005/07/01 05:00:00+00,2005.0,1.0,,,,,,,190.0,,0.0,a8844354-1f14-42f1-baa8-1a55c78807fe,85537.0538315269,,,https://en.wikipedia.org/wiki/Frank_S._Reasoner,no,1937-09-16,Found,47.9,True,seq=6.9; last-mismatch:-4; human:+40; fl:+10; county-miss:-8; us:+5,"Frank Stanley Reasoner was born on September 16, 1937, in Spokane, Washington, and became a distinguished officer in the United States Marine Corps. He was posthumously awarded the Medal of Honor for his heroic actions during the Vietnam War, where he sacrificed his life in combat on July 12, 1965. Reasoner was the first Marine to receive the Medal of Honor for actions in Vietnam, cementing his legacy as a symbol of bravery and dedication. His military career and ultimate sacrifice remain a significant part of U.S. Marine Corps history and the broader narrative of the Vietnam War.","['Gonzaga University, Bachelor of Science in Commerce, 1959']",1965-07-12,"Spokane, Washington, United States",Vietnam,male,no,no,yes,no,,,,,,,,,,,,,Purple Heart,,,,,,https://en.wikipedia.org/wiki/Purple_Heart,True
277,Okeechobee,91.0,Billy Bowlegs III Bridge,"The bridge on S.R. 70 which spans the Kissimmee River is designated as the ""Billy Bowlegs III Bridge.""",,SB 567,1969/05/31 05:00:00+00,1969.0,1.0,,,,,,,219.0,,0.0,661e37d4-c29d-4237-bc78-e302e22a23f2,143.270059560453,,,https://en.wikipedia.org/wiki/Billy_Bowlegs_III,yes,1862-01-01,Found,67.0,True,seq=20.0; human:+40; fl:+10; county-miss:-8; us:+5,"Billy Bowlegs III (1862–1965) was a prominent Seminole leader and the last hereditary chief of the Seminole Tribe of Florida. Born during a period of conflict between the Seminoles and the U.S. government, he became a key figure in preserving Seminole culture and negotiating land rights. He served as a cultural ambassador, bridging relations between his people and the broader American society during the early 20th century. His legacy includes efforts to maintain Seminole traditions and sovereignty amid rapid societal changes.",,1965-01-01,"Florida, United States","Florida, United States",male,no,yes,yes,no,,,,,,,,,,,,,Billy Bowlegs III,,,male,1862-01-01,1965-01-01,https://en.wikipedia.org/wiki/Billy_Bowlegs_III,True
281,Polk,16.0,James Henry Mills Medal of Honor Parkway,"That portion of the Polk County Parkway from I-4 at the Polk/Hillsborough county line east to S.R. 37 in Lakeland is designated as the ""James Henry Mills Medal of Honor Parkway.""",SR-570,CS/SB 1014,1998/05/22 05:00:00+00,1998.0,1.0,Polk County Parkway,,,,,,223.0,,0.0,21dfa9df-d57e-4bc4-a363-091ba63517ef,11743.9352106489,,,,,,,,,,,,,,,,,,,,,,,,,,,,,,,,James Henry Mills,military personnel,,male,1923-05-02,1973-11-11,https://en.wikipedia.org/wiki/James_Henry_Mills,True
282,Polk,16.0,John L. Robinson Highway,"That portion of S.R. 37 and Fort Green Road within the boundaries of Polk County, Florida is designated as the ""John L. Robinson Highway.""",,SB 164,1941/05/01 05:00:00+00,1941.0,1.0,Fort Green Road,,,,,,224.0,,0.0,f1861aef-2c30-4b8e-9f76-f3340fd22ed1,50942.3505250773,,,Not Found,no,,Not Found,21.2,False,seq=15.2; fl:+10; county-miss:-8,,,,,,,,,,,,,,,,,,,,,,,John L. Robinson,politician,,male,1813-05-03,1860-03-21,https://en.wikipedia.org/wiki/John_L._Robinson,False
289,Sarasota,17.0,Circus Bridge,"Bridge number 170167, the Intracoastal Waterway Bridge replacing bridge number 170036 on Business U.S. Highway 41 in Sarasota County is designated as ""Circus Bridge.""",SR-45,HB 9,2004/05/13 05:00:00+00,2004.0,1.0,,,,,,,231.0,,0.0,0f10ab4a-7b08-46b9-b166-6d1feb7b578c,155.759236004036,,,,,,,,,,,,,,,,,,,,,,,,,,,,,,,,Circus,,,,,,https://en.wikipedia.org/wiki/Circus_(bird),False
291,Sarasota,17.0,Gil Waters Bridge,"The portion of S.R. 789/Gulf Stream Avenue in Sarasota between Sunset Drive and Bird Key Drive is designated as ""Gil Waters Bridge.""",,CS/SB 1604,2008/07/01 05:00:00+00,2008.0,1.0,Gulf Stream Avenue,,,,,,233.0,,0.0,b00802f3-8d9f-42b2-b061-5caf92fa09aa,1829.09275657076,,,Not Found,no,,Not Found,9.0,False,seq=8.0; last-mismatch:-4; fl:+10; county-miss:-8; us:+5,,,,,,,,,,,,,,,,,,,,,,,,,,,,,,
293,Sarasota,17.0,Veteran's Memorial Parkway,"The portion of S.R. 72 in Sarasota County from a point immediately east of I-75 to the entrance of the National Veterans Cemetery in Sarasota is designated as ""Veteran's Memorial Parkway.""",SR-72,CS/SB 1604,2008/07/01 05:00:00+00,2008.0,1.0,Clark Road,,,,,,235.0,,0.0,31ef2fcb-97e9-4d13-b840-cf24383153e2,8065.6394439298,"That portion of U.S. Highway 1, also known as State Road 5, between S.",2010.0,,,,,,,,,,,,,,,,,,,,,,,,,,,,,,Veteran's,,,,,,https://en.wikipedia.org/wiki/War_grave,False
295,Broward,86.0,The Honorable Dale G. Bennett Boat Ramp,"Boat ramp number 8 located at mile marker 40.7 on I-75/S.R. 93/Alligator Alley in Broward County is designated as ""The Honorable Dale G. Bennett Boat Ramp.""",I-75,CS/CS/SB 820,2014/07/01 05:00:00+00,2014.0,4.0,Alligator Alley,,,,,,236.0,,0.0,23971b63-a727-4bc5-8403-12e42d7bf668,57.1021071452648,,,,,,,,,,,,,,,,,,,,,,,,,,,,,,,,,,,,,,,
438,Clay,71.0,James C. Penney Memorial Boulevard,"That portion of S.R. 16 in Clay County within the town limits of the Town of Penney Farms is designated as ""James C. Penney Memorial Boulevard.""",,HB 9,2004/05/13 05:00:00+00,2004.0,2.0,,,,,,,248.0,,0.0,1fc3989d-1c8e-4794-aeb7-97080b49b25a,5101.34402082258,,,Not Found,no,,Not Found,7.0,False,seq=17.5; fl-miss:-10; county-miss:-8; us:+5,,,,,,,,,,,,,,,,,,,,,,,,,,,,,,
449,Duval,72.0,Arthur N. Sollee Bridge,"The bridge on J. Turner Boulevard which spans the Intracoastal Waterway in Jacksonville is designated as the ""Arthur N. Sollee Bridge.""",,HB 1092,1985/06/14 05:00:00+00,1985.0,2.0,J. Turner Boulevard,,,,,,259.0,,0.0,0601053c-6585-4875-b7c9-73f4329f7ea3,1621.95156992818,oS.R. 109/University Boulevard between Clifton Avenue and Fort Caroline Road in DuvalCounty is designated as “Jim Tullis memorial Boulevard.,2018.0,Not Found,no,,Not Found,0.0,False,seq=1.4; last-mismatch:-4; fl-miss:-10; county-miss:-8; nobility:-40,,,,,,,,,,,,,,,,,,,,,,,,,,,,,,
450,Duval,72.0,Barbara Van Blake Parkway,"That portion of Lem Turner Road between I-95 and Edgewood Avenue in Duval County is designated as ""Barbara Van Blake Parkway.""",,HB 121,2006/07/01 05:00:00+00,2006.0,2.0,Lem Turner Road,,,,,,260.0,,0.0,c0669c56-ea4b-407d-a8ec-977270110331,1451.36787953866,,,,,,,,,,,,,,,,,,,,,,,,,,,,,,,,,,,,,,,
455,Duval,72.0,C. D. Kinsey Street,"That portion of Beaver Street between Stockton Street and Edgewood Avenue in Duval County is designated as ""C. D. Kinsey Street.""",,CS/SB 138,2007/07/01 05:00:00+00,2007.0,2.0,Beaver Street,,,,,,265.0,,0.0,d016c13d-7700-49f8-90b3-ca4215b7c079,4436.30483004673,S.W. 22nd Avenue between Kirk Street and Tigertail Avenue in Miami-Dade County as “Mama Elsa Street.,2023.0,Not Found,no,,Not Found,7.0,False,seq=3.3; last-mismatch:-4; fl:+10; county-miss:-8; us:+5,,,,,,,,,,,,,,,,,,,,,,,,,,,,,,
459,Duval,72.0,Dan Jones Avenue,"That portion of Dunn Avenue in Jacksonville between I-295 West and I-95 North is designated as ""Dan Jones Avenue.""",,HB 9,2004/05/13 05:00:00+00,2004.0,2.0,Dunn Avenue,,,,,,269.0,,0.0,5f359541-561b-4f9e-be92-b8be7275f28f,8740.14130025597,,,,,,,,,,,,,,,,,,,,,,,,,,,,,,,,,,,,,,,
464,Duval,72.0,Eddie Mae Steward Avenue,"That portion of Main Street between West 6th Street and West 8th Street in Duval County is designated as ""Eddie Mae Steward Avenue.""",,HB 121,2006/07/01 05:00:00+00,2006.0,2.0,Main Street,,,,,,274.0,,0.0,192795b3-49a3-4838-9066-29a0fbfa070f,344.068923282908,W. 27th Avenue and N.W. 25th Avenue in Miami-Dade County is designated as “Margaret Haines Street.,2012.0,,,,,,,,,,,,,,,,,,,,,,,,,,,,,,Eddie Mae Steward,,,female,1938-01-01,2000-01-01,https://en.wikipedia.org/wiki/Eddie_Mae_Steward,True
467,Duval,72.0,George Matthews Boulevard,"That portion of Wilson Boulevard in Duval County between I-295 South and Old Middleburg Road is designated as ""George Matthews Boulevard.""",,CS/SB 1604,2008/07/01 05:00:00+00,2008.0,2.0,Wilson Boulevard,,,,,,277.0,,0.0,c26b2138-c9b3-40f1-81bf-b597fc512631,678.9337999687,oS.R. 109/University Boulevard between Clifton Avenue and Fort Caroline Road in DuvalCounty is designated as “Jim Tullis memorial Boulevard.,2018.0,Not Found,no,,Not Found,19.8,False,seq=13.8; fl:+10; county-miss:-8,,,,,,,,,,,,,,,,,,,,,,,,,,,,,,
475,Duval,72.0,Johnnie Mae Chappell Parkway,"That portion of U.S. Highway 1 between Finch Avenue and Redpoll Avenue in Duval County is designated as ""Johnnie Mae Chappell Parkway.""",US-1,HB 385,2005/07/01 05:00:00+00,2005.0,2.0,New Kings Road,,,,,,285.0,,0.0,700aec2a-9081-4366-9d13-4fef221e9c0f,613.140888659689,,,,,,,,,,,,,,,,,,,,,,,,,,,,,,,,Johnnie Mae Chappell,,,female,1929-00-00,1964-03-23,https://en.wikipedia.org/wiki/Murder_of_Johnnie_Mae_Chappell,True
481,Duval,72.0,Robert 'Bullet Bob' Hayes Avenue,"That portion of Edgewood Avenue W. in Jacksonville from U.S. 1 East to where Edgewood Avenue W. becomes Tallulah is designated as ""Robert 'Bullet Bob' Hayes Avenue.""",,HB 9,2004/05/13 05:00:00+00,2004.0,2.0,Edgewood Avenue,,,,,,291.0,,0.0,7a506cda-7cb0-436b-acca-0e0ba9a6909b,7630.61294106578,,,,,,,,,,,,,,,,,,,,,,,,,,,,,,,,,,,,,,,
489,Duval,72.0,USS Stark Memorial Drive,"That portion of S.R. 101/Mayport Road between S.R. A1A and Wonderwood Connector in Duval County is designated as ""USS Stark Memorial Drive.""",,CS/HB 7039,2012/07/01 05:00:00+00,2012.0,2.0,Mayport Road,,,,,,299.0,,0.0,704619f2-da07-4132-a4ad-885fa6cd149d,1893.84712844887,,,,,,,,,,,,,,,,,,,,,,,,,,,,,,,,USS Stark,,,,,,https://en.wikipedia.org/wiki/USS_Stark,True
496,Hamilton,32.0,Brett Fulton and Josh Burch Memorial Highway,"That portion of U.S. Highway 41/S.R. 6/S.R. 25 between the Madison County line and C.R. 51 in Hamilton County is designated as ""Brett Fulton and Josh Burch Memorial Highway.""",,CS/HB 7039,2012/07/01 05:00:00+00,2012.0,2.0,,,,,,,306.0,,0.0,4cf928c7-126c-4db0-959c-11c1b55c6753,36158.0992570733,,,,,,,,,,,,,,,,,,,,,,,,,,,,,,,,Brett Fulton,rugby league player,,male,,,https://en.wikipedia.org/wiki/Brett_Fulton,False
501,Lafayette,33.0,Frank R. Norris Bridge,"The bridge over the Suwannee River on U.S. Highway 27 at Branford is designated as the ""Frank R. Norris Bridge.""",,CS/HB 1023,1991/05/29 05:00:00+00,1991.0,2.0,,,,,,,311.0,,0.0,4696f186-37f4-4fed-8d65-f7c0cb802d37,305.784474867877,,,Not Found,no,,Not Found,14.6,False,seq=10.6; last-mismatch:-4; fl:+10; county-miss:-8,,,,,,,,,,,,,,,,,,,,,,,,,,,,,,
508,Levy,34.0,U.S. Army SPC James A. Page Memorial Highway,"That portion of U.S. Highway 27A/S.R. 500/Hathaway Avenue between S.R. 24/Thrasher Drive and Town Court in Levy County is designated as ""U.S. Army SPC James A. Page Memorial Highway.""",US-27A,CS/HB 7039,2012/07/01 05:00:00+00,2012.0,2.0,Hathaway Avenue,,,,,,318.0,,0.0,7f03487d-512e-4006-9914-09bb8d0d3593,1886.88198159348,,,Not Found,no,,Not Found,22.0,False,seq=4.5; last-mismatch:-4; mil:+15; fl:+10; county-miss:-8; us:+5,,,,,,,,,,,,,,,,,,,,,,,,,,,,,,
534,Nassau,74.0,MaVynne 'The Beach Lady' Betsch Highway,"That portion of Florida First Coast Highway beginning at Burney Road and continuing north through the 5500 block of Florida First Coast Highway in Nassau County is designated as ""MaVynne 'The Beach Lady' Betsch Highway.""",,HB 121,2006/07/01 05:00:00+00,2006.0,2.0,Florida First Coast Highway,,,,,,344.0,,0.0,ff585065-5fd7-4c84-91c8-87027a5ddae2,587.686172939349,Milepost 22.182on U.S. Highway 27 in Highlands County is designated as “Florida Highway Patrol Trooper Sgt.,2012.0,,,,,,,,,,,,,,,,,,,,,,,,,,,,,,,,,,,,,
538,Putnam,76.0,Frank Thomas McMeekin Highway,"That portion of S.R. 20 running between the Towns of Johnson and McMeekin, Putnman County, Florida, is designated as the ""Frank Thomas McMeekin Highway.""",SR-20,SB 634,1963/05/23 05:00:00+00,1963.0,2.0,,,,,,,348.0,,0.0,f160017f-63ac-4013-8aac-ea88c7cec7eb,5401.11731680004,,,https://en.wikipedia.org/wiki/Ed_Begley_Jr.,no,1949-09-16,Found,47.0,True,seq=1.2; last-mismatch:-4; human:+40; fl:+10; county-miss:-8; us:+5,"Ed Begley Jr. is an American actor and environmental activist born on September 16, 1949. Known for his roles in films like This Is Spinal Tap and TV shows such as St. Elsewhere and Arrested Development, he has earned seven Primetime Emmy nominations. Beyond acting, Begley is a prominent advocate for sustainable living, authoring books and hosting eco-friendly TV programs. His career spans over five decades, blending entertainment with activism for environmental causes.","['Los Angeles City College', 'Associate of Arts, Theater Arts']",,"Los Angeles, California, United States",not found,male,no,no,no,no,,,,,,,,,,,,,,,,,,,,
550,Taylor,38.0,Byron Butler Parkway,"That portion of U.S. 19 within the city limits of Perry, Taylor County is designated as ""Byron Butler Parkway.""",US-19,HB 1741,1977/07/05 05:00:00+00,1977.0,2.0,Springfield Street,,,,,,360.0,,0.0,64c8674a-2a10-40c0-a25e-11e56963dc73,5902.62341734182,,,,,,,,,,,,,,,,,,,,,,,,,,,,,,,,,,,,,,,
554,Union,39.0,Correction Officers Memorial Bridge,"The New River Bridge on S.R. 16 in Bradford and Union Counties is designated as ""Correction Officers Memorial Bridge.""",,HB 385,2005/07/01 05:00:00+00,2005.0,2.0,,,,,,,364.0,,0.0,0574ee69-3b17-4ea8-b08c-955b93cc4cba,137.232197433564,,,Not Found,no,,Not Found,21.8,False,seq=9.8; last-mismatch:-4; fl:+10; county:+8,,,,,,,,,,,,,,,,,,,,,,,Correction Officers,,,,,,https://en.wikipedia.org/wiki/Correction_Officers%27_Benevolent_Association,False
564,Bay,46.0,"Lieutenant Colonel Carl John Luksic, USAF, Memorial Highway","That portion of U.S. 98/S.R. 30A/Tyndall Parkway between C.R. 2327/Transmitter Road and S.R. 22 in Bay County is designated as ""Lieutenant Colonel Carl John Luksic, USAF, Memorial Highway.""",,CS/CS/SB 820,2014/07/01 05:00:00+00,2014.0,3.0,Tyndall Parkway,,,,,,374.0,,0.0,867f8fae-7954-40d7-a602-9aeefda1fce7,4348.36695623034,That portion of Northeast Sixth Avenue between Northeast 113th and 121st Street in Miami-Dade County is designated as “Biscayne Park Way.,2010.0,https://en.wikipedia.org/wiki/Carl_J._Luksic,yes,,Found,32.8,True,seq=11.8; last-mismatch:-4; human:+40; fl-miss:-10; county-miss:-8; us:+5,"Carl J. Luksic was a World War II flying ace who served in the United States Army Air Forces. He achieved notable success as a fighter pilot, shooting down multiple enemy aircraft before being captured and held as a prisoner of war. After the war, he continued his career in aviation and contributed to military and civilian aviation efforts. His legacy is marked by his bravery and skill as a combat pilot during one of history's most significant conflicts.",,,not found,not found,male,no,no,yes,no,,,,,,,,,,,,,,,,,,,,
567,Calhoun,47.0,C. D. Clark Road,"That portion of C.R. 275 that starts at the intersection of S.R. 71 and goes south until it connects with Marysville School Road in Calhoun County is designated as the ""C. D. Clark Road.""",,HB 1686,1959/06/12 05:00:00+00,1959.0,3.0,,,,,,,377.0,,0.0,f354e6f3-84e4-4fba-911b-7e600b6d6922,5835.29880352859,,,,,,,,,,,,,,,,,,,,,,,,,,,,,,,,,,,,,,,
575,Escambia,48.0,Dr. Phillip A. Payne Bridge,"The Cervantes Street Bridge on U.S. Highway 90 over Bayou Texar in the City of Pensacola in Escambia County is designated as ""Dr. Philip A. Payne Bridge.""",,HB 121,2006/07/01 05:00:00+00,2006.0,3.0,Cervantes Street,,,,,,385.0,,0.0,dcff69b0-0bae-4b69-9a9a-7cb125d82d24,194.93834068228,E. 8th Avenue and N.E. 9th Avenue in Miami-Dade County is designated as “Sergeant Carl Mertes Street.,2014.0,Not Found,no,,Not Found,11.6,False,seq=10.6; last-mismatch:-4; fl:+10; county-miss:-8; us:+5,,,,,,,,,,,,,,,,,,,,,,,,,,,,,,
581,Escambia,48.0,Perdido Key Parkway,"That portion of S.R. 292 from Blue Angel Parkway to the beginning of Perdido Key Drive in Escambia County is designated as ""Perdido Key Parkway.""",SR-292,HB 5,2010/07/01 05:00:00+00,2010.0,3.0,Sorrento Road,,,,,,391.0,,0.0,0f9abb3d-815f-47c6-ab48-dd39e72fa735,9485.44669728646,"That portion of U.S. Highway 1, also known as State Road 5, between S.",2010.0,,,,,,,,,,,,,,,,,,,,,,,,,,,,,,Perdido Key,,,,,,"https://en.wikipedia.org/wiki/Perdido_Key,_Florida",True
591,Gadsden,50.0,"Alfred Lawson, Jr., Highway","That portion of U.S. Highway 90/S.R. 10/East Jefferson Street between S.R. 12/S.R. 65/Madison Street and C.R. 159 in Gadsden County is designated as ""Alfred Lawson, Jr., Highway.""",,CS/HB 7039,2012/07/01 05:00:00+00,2012.0,3.0,East Jefferson Street,,,,,,401.0,,0.0,fcfd53ff-7c95-474a-a689-9c0127316425,18266.3726485102,R. 821/Homestead Extension of the Florida Turnpike and S.W. 99th Court in Miami-Dade County is designated as “Reverend John A. Ferguson Street.,2014.0,Not Found,no,,Not Found,14.8,False,seq=13.8; last-mismatch:-4; fl:+10; county-miss:-8; us:+5,,,,,,,,,,,,,,,,,,,,,,,,,,,,,,
600,Holmes,52.0,Curry Bridge,"The bridge on C.R. 177 crossing Wright's Creek in Holmes County, Florida is designated as the ""Curry Bridge.""",,HB 1577,1941/06/10 05:00:00+00,1941.0,3.0,,,,,,,410.0,,0.0,26146a38-6d20-48e5-823e-e4c9e62d482c,142.150800360727,,,,,,,,,,,,,,,,,,,,,,,,,,,,,,,,Curry,,,,,,https://en.wikipedia.org/wiki/Curry_(surname),False
631,Okaloosa,57.0,Brian D. Little Road,"That portion of S.R. 188 between S.R. 189 and S.R. 85 in Okaloosa County is designated as ""Brian D. Little Road.""",,HB 121,2006/07/01 05:00:00+00,2006.0,3.0,Racetrack Road,,,,,,441.0,,0.0,4da76162-e6df-4a92-b25b-f35f7fdc07ea,4821.3163460919,,,,,,,,,,,,,,,,,,,,,,,,,,,,,,,,,,,,,,,
634,Okaloosa,57.0,Colonel Bud Day Boulevard,"That portion of S.R. 397 from Government Avenue to the North gate at Eglin Air Force Base in Okaloosa County is designated as ""Colonel Bud Day Boulevard.""",SR-397,HB 5,2010/07/01 05:00:00+00,2010.0,3.0,John Sims Parkway,,,,,,444.0,,0.0,c89f83cc-af53-488c-a577-a3ee1916e346,4243.22030851738,,,Not Found,no,,Not Found,23.0,False,seq=4.8; last-mismatch:-4; fl:+10; county:+8; us:+5,,,,,,,,,,,,,,,,,,,,,,,Colonel Bud Day,,,,,,https://en.wikipedia.org/wiki/Sioux_Gateway_Airport,False
636,Okaloosa,57.0,Danny Wuerffel Way,"That portion of S.R. 293 (Mid-Bay Bridge Road) from the south portion of the bridge toward U.S. Highway 98 in Destin is designated as ""Danny Wuerffel Way.""",,CS/SB 1366,1997/05/30 05:00:00+00,1997.0,3.0,Mid‐Bay Bridge Road,,,,,,446.0,,0.0,ff8efed7-1ed2-4ece-b022-df5c65c6a751,1829.14785731936,,,https://en.wikipedia.org/wiki/Danny_Wuerffel,yes,1974-05-27,Found,67.0,True,seq=20.0; human:+40; fl:+10; county-miss:-8; us:+5,"Danny Wuerffel is a former American football quarterback born on May 27, 1974, in Pensacola, Florida. He is best known for winning the Heisman Trophy in 1996 while playing for the University of Florida Gators, where he led the team to multiple SEC championships. Wuerffel played professionally in the NFL for teams like the New Orleans Saints and later in the Arena Football League. Beyond sports, he is recognized for his philanthropic work, founding the Desire Street Ministries to support underprivileged communities.","['Fort Walton Beach High School, Florida', ""University of Florida, Bachelor's Degree in Public Relations""]",,"Pensacola, Florida, United States",not found,male,yes,no,no,no,,,,,,,,,,,,,Danny Wuerffel,American football player,,male,1974-05-27,,https://en.wikipedia.org/wiki/Danny_Wuerffel,True
655,Wakulla,59.0,Angus Morrison Memorial Highway,"That portion of S.R. 30, extending from S.R. 61 to S.R. 363 in Wakulla County, Florida, is designated as the ""Angus Morrison Memorial Highway.""",,SB 600,1961/05/30 05:00:00+00,1961.0,3.0,,,,,,,465.0,,0.0,0a81fda0-45c1-4bbd-b3d1-5bc55c2760c0,22781.1438661959,,,https://en.wikipedia.org/wiki/Angus_Morrison_%28canoeist%29,no,,Found,47.0,True,seq=20.0; human:+40; fl-miss:-10; county-miss:-8; us:+5,"Angus Morrison was a Scottish canoeist known for his contributions to the sport during the early to mid-20th century. He competed in slalom canoeing and was recognized for his skill in navigating challenging river courses. Morrison played a key role in popularizing canoeing in Scotland and the broader UK, though specific details about his competitive career are limited. His legacy endures primarily through historical records of early canoeing pioneers.",,,not found,not found,male,yes,no,no,no,,,,,,,,,,,,,Angus Morrison,lawyer,,male,1822-01-20,1882-06-10,https://en.wikipedia.org/wiki/Angus_Morrison_(politician),False
657,Wakulla,59.0,Gretchen Evans Memorial Bridge,"The bridge on U.S. 98 in Wakulla County at the Wakulla River is designated as ""Gretchen Evans Memorial Bridge.""",US-98,HB 5,2010/07/01 05:00:00+00,2010.0,3.0,Coastal Highway,,,,,,467.0,,0.0,6112cab5-524d-4dd4-a125-16541d00e780,139.141575285032,,,https://en.wikipedia.org/wiki/Monique_Evans_%28Miss_Texas%29,no,,Found,61.4,True,seq=10.4; human:+40; fl:+10; county-miss:-8; us:+5,"Monique Evans is an American beauty pageant titleholder best known for winning Miss Texas USA 2007. She represented Texas in the Miss USA 2007 pageant, where she placed in the top 10. Born in the late 20th century, she gained recognition for her advocacy work and public appearances during her reign. Evans remains a notable figure in Texas pageant history for her contributions to the competition and community service efforts.",,,not found,not found,female,no,no,no,no,,,,,,,,,,,,,,,,,,,,
664,Washington,61.0,Ben G. Watts Highway,"That portion of U.S. Highway 90/S.R. 10 between Holmes County line and the Jackson County line in Washington County is designated as ""Ben G. Watts Highway.""",US-90,CS/HB 7039,2012/07/01 05:00:00+00,2012.0,3.0,,,,,,,474.0,,0.0,2730cfe4-1433-4870-8233-0b081f661a52,42971.6610604424,,,https://en.wikipedia.org/wiki/Ben_Douglas_%28American_football%29,no,1893-01-01,Found,61.2,True,seq=12.2; last-mismatch:-4; human:+40; fl:+10; county-miss:-8; us:+5,"Ben Douglas was an American football player known for his contributions to the sport during the early 20th century. Born in 1893, he played as a guard and was part of the University of Pittsburgh football team, where he earned recognition for his athletic prowess. Douglas later pursued a career in coaching and officiating, leaving a lasting impact on the development of American football. His legacy is tied to the growth of collegiate and professional football during its formative years.",['University of Pittsburgh'],,not found,not found,male,yes,no,no,no,,,,,,,,,,,,,,,,,,,,
