source_url,name,bio,age,tour,badge,cause,end_of_watch,incident_details,matched_input_name,fuzzy_score
https://www.odmp.org/officer/11092-patrolman-james-k-reed,Patrolman James K. Reed,"Officer James Reed suffered a heart attack while issuing a parking ticket in front of 924 Mt. Vernon Avenue in Columbus. Another officer immediately began administering CPR, and a passerby called for help. Officer Reed died a short time later in the emergency room at St. Anthony Hospital. Officer Reed was a United States Marine Corps Vietnam veteran and had served with the Columbus Division of Police for two years. He was survived by his parents, brother, and sister.",25,2 years,Not available,Heart attack,"Saturday, May 18, 1974",Cause: Heart attack,James W. Reed,92.3076923076923
https://www.odmp.org/officer/11580-patrolman-dane-l-rowe,Patrolman Dane L. Rowe,"Patrolman Dane Rowe was struck and killed by a car while clearing a crash scene. The driver of the car that struck him was driving through the accident scene after ignoring signals from another officer to stop. Patrolman Rowe was transported to Grant Medical Center where he succumbed to his injuries the following day. Patrolman Rowe had served with the Madison Township Police Department for 9-1/2 months. He was survived by his wife, parents, and brother.",24,"9 months, 2 weeks",11,Struck by vehicle,"Saturday, November 5, 1988","Cause: Struck by vehicle Incident Date: Friday, November 4, 1988",Patrolman Dane L. Rowe,100.0
https://www.odmp.org/officer/11600-corporal-john-e-ruch,Corporal John E. Ruch,Corporal John Ruch was killed in an automobile accident during a high-speed pursuit on US Route 20 in Ashtabula County. He and another patrolman were en route to a defense meeting when they attempted to stop a speeding vehicle. Their patrol car went out of control on ice and snow and struck two trees. Corporal Ruch had served with the agency for 8 years and was stationed in Geneva at the time. He was survived by his wife and parents.,32,8 years,28/134,Vehicle pursuit,"Wednesday, March 4, 1942",Cause: Vehicle pursuit Weapon: Not available Offender: Not available,Corporal John E. Ruch,100.0
https://www.odmp.org/officer/11668-sergeant-patrick-ryan,Sergeant Patrick Ryan,"Sergeant Patrick Ryan died from injuries sustained in an automobile crash two miles north of Brooksville, Florida, while en route to pick up a prisoner for extradition back to Ohio. He and the Cuyahoga County prosecutor had gone to pick up a vote fraud suspect, who was being held in Miami, Florida. The prosecutor's car crashed into the rear end of a car that had stopped suddenly in front of them, causing it to flip over. Sergeant Ryan, who had been detailed to the prosecutor's office, was seriously hurt and died several hours later in a hospital in Brooksville, Florida. Sergeant Ryan had served with the Cleveland Division of Police for 40 years. He was survived by his wife and son.",70,40 years,Not available,Automobile crash,"Friday, January 14, 1944",Cause: Automobile crash Location: Florida,Army Sergeant Patrick Ryan Carroll,100.0
https://www.odmp.org/officer/12781-patrolman-david-l-sterner,Patrolman David L. Sterner,"Patrolman David Sterner was killed in an automobile crash while pursuing a vehicle on State Route 15 south of Finley. When another vehicle pulled in front of his patrol car at State Route 37, he attempted to avoid a collision and struck a culvert. Patrolman Sterner had served with the Ohio State Highway Patrol for eight months. He was survived by his wife and parents.",22,8 months,1139/1506,Vehicle pursuit,"Sunday, February 25, 1973",Cause: Vehicle pursuit Weapon: Not available Offender: Not available,Patrolman David L. Sterner Memorial Interchange,100.0
https://www.odmp.org/officer/13300-patrolman-carl-l-shorty-thrush,"Patrolman Carl L. ""Shorty"" Thrush","Patrolman Carl Thrush was killed in an automobile crash on State Route 93 north of McArthur in Vinton County when his patrol car struck an ice patch, hit another car head-on, and went over an embankment. He was on his way to investigate another vehicle collision on Route 160 when the incident occurred. Patrolman Thrush had served with the Ohio State Highway Patrol for seven years, assigned to the Athens Post. He was survived by his wife and two sons.",30,"7 years, 8 months",20/1064,Automobile crash,"Sunday, February 6, 1972",Cause: Automobile crash,"Patrolman Carl ""Shorty"" Thrush",100.0
https://www.odmp.org/officer/13684-trooper-charles-v-vogel-jr,"Trooper Charles V. Vogel, Jr.","Trooper Charles Vogel was struck and killed by a vehicle while investigating a series of accidents at the junction of I-70 and US Route 68 in Clark County. The roadways were ice covered, causing another vehicle to strike him as he assisted victims on the median. Trooper Vogel had served with the Ohio State Highway Patrol for one year and was assigned to the Springfield Post. He was survived by his wife, child, and parents.",25,1 year,346/383,Struck by vehicle,"Thursday, January 24, 1980",Cause: Struck by vehicle,"Trooper Charles V. Vogel, Jr.",100.0
https://www.odmp.org/officer/14709-trooper-james-r-gross,Trooper James R. Gross,"Trooper James Gross was shot and killed during a traffic stop in Ashland on I-71. A truck driver had noticed a car driving erratically and contacted the police via CB. During the stop, Trooper Gross was shot once in his left arm. As he attempted to take cover, he slipped on the wet pavement and fell to the ground. The suspect shot him in the back as he lay on the ground. The round entered below his vest and traveled upwards through his torso. Other truckers who witnessed the shooting used their CB radios to notify authorities of the incident. The suspect was apprehended when he crashed into an embankment following a 29-mile chase. The ensuing investigation determined that the suspect had previously shot his mother in the foot. The 30-year-old suspect was initially sentenced to death. In 2005 his death sentence was commuted to life. He will be eligible for parole in June of 2044. Trooper Gross had served with the Ohio State Highway Patrol for 2 years. He was survived by his wife. A portion of Interstate 71 in Ashland County, between mileposts 189 and 191, has been dedicated and renamed the James R. Gross Memorial Highway.",27,2 years,Not available,Gunfire,"Friday, January 19, 1996",Cause: Gunfire Weapon: Handgun Offender: Sentence commuted to life,Trooper James R. Gross,100.0
https://www.odmp.org/officer/15414-police-officer-wayne-a-leon,Police Officer Wayne A. Leon,"Police Officer Wayne Leon was shot and killed during a routine traffic stop at East 40th Street and Community College. When Officer Leon exited his vehicle, the subject approached and shot Officer Leon in the face. Officer Leon was transported to a local hospital, where he passed away. The 29-year-old suspect escaped after being involved in a chase with other officers but was arrested later in the day. The man was on parole from a 10-year sentence for a 1995 attempted robbery conviction. He was found guilty of the aggravated murder of a police officer in November 2000 and sentenced to death. His execution is scheduled for 2028. Officer Leon had served with the Cleveland Police Department for six years. He is survived by his wife and three young children. A section of Lorain Avenue located in front of St. Ignatius High School was renamed the Officer Wayne Leon Memorial Highway.",32,6 years,1338,Gunfire,"Sunday, June 25, 2000",Cause: Gunfire Weapon: Handgun Offender: Sentenced to death,Wayne A. Leon,100.0
https://www.odmp.org/officer/15862-trooper-frank-galvan-vazquez,Trooper Frank Galvan Vazquez,"Trooper Frank Vazquez was killed when he was struck by a drunk driver while conducting a traffic stop on I-270 in Columbus, Ohio. He was standing outside of his vehicle when the drunk driver struck the rear of his patrol car. The patrol car and the suspect's vehicle collided with Trooper Vazquez and into the stopped vehicle. The 33-year-old drunk driver, convicted four times for drunk driving, was charged with aggravated vehicular homicide and drunk driving. On May 20, 2002, the driver was sentenced to 8 1/2 years in prison. He was released in December of 2009. On May 14, 2012, he was sent back to prison for 30 months for driving while his license was permanently revoked. Trooper Vazquez had served with the Ohio Highway Patrol for almost four years. He is survived by his wife and three young children.",26,4 years,975,Vehicular assault,"Tuesday, November 6, 2001","Cause: Vehicular assault Incident Date: Monday, November 5, 2001 Weapon: Automobile; Alcohol involved Offender: Released in 2009",Trooper Frank G. Vazquez,93.33333333333333
https://www.odmp.org/officer/1677-patrolman-leroy-s-bedell,Patrolman LeRoy S. Bedell,"Patrolman LeRoy Bedell was killed in a motorcycle crash while patrolling State Route 59 in Erie County, six miles east of Bellevue, at 3:35 pm. A dog lunged at his motorcycle, causing him to lose control as he attempted to avoid striking it. He was thrown onto the highway and suffered a broken neck. He was transported to Bellevue Hospital, where he succumbed to his injuries 15 minutes later. Patrolman Bedell had served with the Ohio State Highway Patrol for two years, was assigned to Bellevue, and previously served with the Heron County Sheriff's Office. He is survived by his wife, five children, and mother. State Route 59 is current day OH 113.",34,"2 years, 9 months",15,Motorcycle crash,"Tuesday, August 20, 1935",Cause: Motorcycle crash,Patrolman Leroy S. Bedell,100.0
https://www.odmp.org/officer/17467-deputy-sheriff-brandy-lyn-winfield,Deputy Sheriff Brandy Lyn Winfield,"Deputy Sheriff Brandy Winfield was shot and killed after being dispatched to check on a disabled vehicle on State Route 423. After responding to the call, Deputy Winfield encountered two men walking along the road and made contact with them. No further radio contact was made with dispatchers. A short time later, Deputy Winfield was found shot in his patrol car, which was upside down in a ravine along the roadway. Deputy Winfield was transported to a local hospital where he died. The original vehicle was located a short time later off Route 23 near Delaware following a massive manhunt. Two suspects were apprehended later in the week and were charged with aggravated murder. One of the suspects was sentenced to 2 years probation for obstruction of justice. The 20-year-old shooter was convicted of murder and sentenced to 40 years to life. He will be eligible for parole on October 4, 2047. Deputy Winfield had served with the Marion County Sheriff's Department for 6 years. He is survived by his wife and two children. His great-grandfather also served with the Marion County Sheriff's Office, and his father and brother served with the Marion City Police Department. In 2024, his son joined the Marion County Sheriff's Office as a deputy.",29,6 years,6,Gunfire,"Thursday, October 14, 2004",Cause: Gunfire Weapon: Handgun Offender: Sentenced to life,Deputy Brandy Winfield,100.0
https://www.odmp.org/officer/18112-deputy-sheriff-ethan-g-collins,Deputy Sheriff Ethan G. Collins,"Deputy Ethan Collins was killed in an automobile accident on State Route 188, just outside of Lancaster, while responding to an officer needs assistance call at 3:45 pm. His patrol car went out of control, rolled over, and struck a utility pole near the intersection of SR188 and Beck's Knob Road. Deputy Collins had served with the Fairfield County Sheriff's Office for six years. He is survived by his wife, son, and daughter.",29,6 years,268,Automobile crash,"Wednesday, January 4, 2006",Cause: Automobile crash,Deputy Ethan Collins,100.0
https://www.odmp.org/officer/19545-deputy-sheriff-marty-michael-martin,Deputy Sheriff Marty Michael Martin,"Deputy Sheriff Marty Martin was killed in an automobile crash on I-71 near I-270 while he and another deputy worked an undercover operation at approximately 12:30 a.m. Their unmarked SUV hydroplaned as a result of heavy rain struck a culvert, and overturned. Deputy Martin was transported to a local hospital where he succumbed to his injuries. His partner sustained moderate injuries. Deputy Martin had served with the Franklin County Sheriff's Department for 10 years. He is survived by his wife and son.",35,10 years,745,Automobile crash,"Saturday, September 6, 2008",Cause: Automobile crash,Deputy Marty Martin,100.0
https://www.odmp.org/officer/20256-trooper-andrew-c-baldridge,Trooper Andrew C. Baldridge,"Trooper Andrew Baldridge was killed in an automobile crash while responding to backup a deputy from the Wyandot County Sheriff's Office. The patrol car Trooper Baldridge was driving overturned west of Carey on township Road 95, south of state Route 103, causing fatal injuries. His training officer sustained non-life-threatening injuries. Trooper Baldridge had graduated from the academy as a member of the 149th Academy Class in December. He is survived by his parents, sister, brother, and nephew.",25,2 months,0053,Automobile crash,"Thursday, February 4, 2010",Cause: Automobile crash,Trooper Andrew C. Baldridge,100.0
https://www.odmp.org/officer/20348-police-officer-thomas-f-patton-ii,"Police Officer Thomas F. Patton, II","Police Officer Thomas Patton suffered a fatal heart attack while chasing a suspect. Officer Patton responded to assist another officer who was in foot pursuit of a man who had been harassing two women inside a convenience store. When that officer tried to make an arrest, the subject spit in his face and fled on foot. The officer pursued and called for assistance. Officer Patton responded and joined in the pursuit, which went through the woods and several backyards. At Glenmont and Mayfield Roads, Officer Patton bent over, rested his hands on his knees for a moment and then continued running. He collapsed shortly after. He was transported to Huron Hospital where he was pronounced dead a short time later. The subject he was chasing plead guilty to involuntary manslaughter and was sentenced to four years in prison. Officer Patton had served with the Cleveland Heights Police Department for nine years. He is survived by his 4-month-old daughter, fiancee, five sisters, and his father, Ohio State Senator Thomas F. Patton.",30,9 years,345,Heart attack,"Saturday, March 13, 2010",Cause: Heart attack Weapon: Person Offender: Sentenced to 4 years,Thomas F. Patton II,94.73684210526316
https://www.odmp.org/officer/20636-deputy-sheriff-suzanne-michelle-hopper,Deputy Sheriff Suzanne Michelle Hopper,"Deputy Sheriff Suzanne Hopper was shot and killed after responding to a call of a window being shot out at a trailer park in Enon. While conducting a preliminary investigation, Deputy Hopper observed a footprint and took out a camera to photograph it. As she was taking photographs, a male opened the door to his trailer and fired one shot at Deputy Hopper with a shotgun, killing her. Additional deputies and officers from area police departments arrived at the scene and surrounded the trailer. A standoff ensued in which dozens of shots were fired between the suspect and officers. A police officer from the German Township Police Department was wounded and the suspect was ultimately killed during the shootout. The suspect's girlfriend was convicted of charges connected with providing the man the gun he used to killer Deputy Hopper. The girlfriend was sentenced to five years in prison. Deputy Hopper had served with the Clark County Sheriff's Office for 12 years.  She is survived by her husband, two children, and two stepchildren.",40,12 years,12-69,Gunfire,"Saturday, January 1, 2011",Cause: Gunfire Weapon: Shotgun Offender: Shot and killed,Deputy Suzanne Hopper,100.0
https://www.odmp.org/officer/20664-police-officer-thomas-raymond-hayes,Police Officer Thomas Raymond Hayes,"Police Officer Tom Hayes succumbed to complications of a gunshot wound sustained 31 years earlier while attempting to arrest two teens on a curfew violation. He had responded to a local convenience store after receiving reports of a disturbance by the two teens at 2:25 a.m. The boys had been drinking, smoking marijuana, and had taken LSD. As Officer Hayes attempted to arrest them, a scuffle ensued in which one of the boys pulled out a handgun and shot him in the back. The wound caused him to become paralyzed below the waist. Officer Hayes continued to suffer serious health issues as a result of the wound, including the amputation of one of his legs six years prior to his death. In March 2011, Officer Hayes' death was ruled a homicide by the Franklin County Coroner. One youth was found guilty of delinquency charges and committed to the Ohio Youth Commission. The juvenile, who shot Officer Hayes, was tried as an adult and convicted of felonious assault and carrying a concealed weapon. He served almost 24 years in prison before being released in 2004. Officer Hayes was a United States Army veteran. Prior to being shot, he had served with the Columbus Division of Police for seven years. Despite his wounds and health issues, Officer Hayes continued to work as a civilian sketch artist for the agency. He was survived by his wife.",61,7 years,Not available,Gunfire,"Thursday, January 20, 2011","Cause: Gunfire Incident Date: Tuesday, December 18, 1979 Weapon: Gun; Unknown type Offender: Not available",Thomas Hayes,100.0
https://www.odmp.org/officer/20741-captain-daniel-patrick-stiles,Captain Daniel Patrick Stiles,"Captain Dan Stiles was struck and killed by the driver of a vehicle while directing traffic at approximately 7:50 a.m. He was at the intersection of Edison Street NW and Kaufman Avenue NW directing traffic for a nearby school. Despite wearing a reflective vest, he was struck by an oncoming SUV whose driver stated she did not see him. Captain Stiles was transported to Akron City Hospital where he succumbed to his injuries three hours later. The driver pled no contest to a misdemeanor vehicular manslaughter and was sentenced to 90 days. Captain Stiles, a U.S. Marine Corps veteran, served with the Uniontown Police Department for two years and had previously served with the Hartville Police Department for 18 years. He is survived by his wife and three daughters.",46,20 years,903,Struck by vehicle,"Tuesday, February 15, 2011",Cause: Struck by vehicle,Daniel Stiles,100.0
https://www.odmp.org/officer/20834-sergeant-brian-scott-dulle,Sergeant Brian Scott Dulle,"Sergeant Brian Dulle was struck and killed by a suspect's vehicle while deploying stop sticks at the intersection of U.S. 42 and Utica Road in Turtlecreek Township. The pursuit had been initiated by the Franklin Police Department and traveled into Warren County at 1:50 am. The suspect ran one cruiser off the road and into a ditch on U.S. 42 before continuing towards Utica Road. After striking Sergeant Dulle, the suspect fled on foot but was arrested several hours later following a massive manhunt. In October 2011, Sergeant Dulle's killer was convicted of murder and seven other charges in connection with the incident, and sentenced to 25 years in prison. Sergeant Dulle was a U.S. Army veteran and had served with the Warren County Sheriff's Office for 12 years. He is survived by his wife, three children, parents, and two siblings. He is buried in Lebanon Cemetery, Lebanon, Warren County, Ohio.",36,12 years,822,Vehicular assault,"Tuesday, May 10, 2011",Cause: Vehicular assault Weapon: Automobile Offender: Sentenced to 25 years,Sergeant Brian Dulle,100.0
https://www.odmp.org/officer/22273-police-officer-justin-robert-winebrenner,Police Officer Justin Robert Winebrenner,"Police Officer Justin Winebrenner was shot and killed while confronting an armed subject while off duty at approximately 2:00 am. He and several friends were at a pub in the 1800 block of East Market Street when another patron became disorderly and was ejected from the business. The man returned a short time later and brandished a handgun at the staff and other customers. A staff member who knew Officer Winebrenner was a police officer alerted him to the situation. He and another off-duty officer confronted the man, who then opened fire. Officer Winebrenner was struck once in the chest and suffered a fatal wound, while the other officer suffered a non-life-threatening gunshot wound. Three citizens were also shot and wounded. The subject, a convicted felon, fled the scene on foot but was located and taken into custody by a canine unit approximately one mile away. He was convicted of first-degree murder and sentenced to life without the possibility of parole on October 28, 2015. Officer Winebrenner had served with the Akron Police Department for seven years and had previously served with the Medina County Juvenile Detention Center for two years. He is survived by his 4-year-old daughter and fiancee.",32,"7 years, 7 months",360,Gunfire,"Sunday, November 16, 2014",Cause: Gunfire Weapon: Handgun Offender: Sentenced to life,Justin Winebrenner,100.0
https://www.odmp.org/officer/22965-trooper-kenneth-v-velez,Trooper Kenneth V. Velez,"Trooper Kenneth Velez was struck and killed by a vehicle while conducting a traffic stop on I-90, near the Warren Road exit, in Cuyahoga County. In August 2017 the driver who struck him was acquitted of vehicular homicide charges, but was convicted of driving on a suspended license and other related misdemeanor charges. Trooper Velez had served with the Ohio State Highway Patrol for 27 years. He is survived by his wife and three children.",48,27 years,511,Struck by vehicle,"Thursday, September 15, 2016",Cause: Struck by vehicle,Trooper Kenneth Velez Memorial Highway.,93.33333333333333
https://www.odmp.org/officer/23545-patrolman-marvin-scott-moyer,Patrolman Marvin Scott Moyer,"Patrolman Scott Moyer died as the result of contracting an infectious disease while backing up another officer to apprehend a resisting subject on February 25th, 1998. The officer had to break the window to remove the man from his car during a traffic stop as the man attempted to flee near the intersection of Forest Rose Avenue and North Street. Some of the glass became embedded in the man's foot, causing lacerations. The man begged Patrolman Moyer to help remove the glass. Patrolman Moyer, who also had a cut on his hand, came in contact with the infected man's blood. Patrolman Moyer contracted the infectious disease and died as a result on May 26th, 2017. Patrolman Moyer was a United States Vietnam War veteran had served with the Lancaster Police Department for 18 years. He was survived by his wife, six children, four sisters, a brother, and two grandchildren.",66,18 years,99,Duty related illness,"Friday, May 26, 2017","Cause: Duty related illness Incident Date: Wednesday, February 25, 1998 Weapon: Person Offender: Not available",M. Scott Moyer,92.3076923076923
https://www.odmp.org/officer/2376-patrolman-william-f-brown,Patrolman William F. Brown,"Patrolman William Brown was shot and killed when he interrupted a robbery in progress at the Certified Oil Station on Cole Street and Robb Avenue while on patrol. When he entered the gas station, he asked the attendant if everything was okay. The attendant, who had been told by the suspect to cooperate, responded that everything was fine. Patrolman Brown then asked the suspect to remove the covering from his face. The man suddenly produced a gun and opened fire, striking Patrolman Brown four times. Patrolman Brown was able to fire one round as he fell. He then crawled to his patrol car and called for assistance before succumbing to his wounds. The suspect and his accomplice, both 18, fled the store, but both were eventually apprehended. On January 11, 1975, the gunman was sentenced to life in prison. He has a parole hearing on February 1, 2024. His accomplice was convicted of involuntary manslaughter and robbery and sentenced to two consecutive 7 to 25-year prison terms. Patrolman Brown had served with the Lima Police Department for 16 years. He is survived by his wife, two daughters, five sons, and his mother.",41,16 years,Not available,Gunfire,"Saturday, January 5, 1974",Cause: Gunfire Weapon: Gun; Unknown type Offender: Sentenced to life,William J. Brown,93.75
https://www.odmp.org/officer/24741-police-officer-anthony-hussein-dia,Police Officer Anthony Hussein Dia,"Police Officer Anthony Dia was shot and killed after responding to a disturbance at a Home Depot store at 1035 West Alexis Road at about 12:30 am. A drunk subject had started to harass participants of an informal car show in the store's parking lot. Officer Dia was the first officer on the scene and attempted to contact the subject. The man produced a handgun and opened fire, striking Officer Dia in the chest. Despite his wounds, Officer Dia was able to return fire as the man fled. The subject fled into a nearby wooded area, where he committed suicide. Witnesses to the shooting began to provide medical aid to Officer Dia. Another responding officer transported him to a local hospital, where he succumbed to his wounds. Officer Dia had served with the Toledo Police Department for two years and had previously served with the Mercy Health Police Department for two years. He is survived by his wife, two sons, and parents. In 2022, State Route 184 was dedicated as the Officer Anthony Dia Memorial Highway between mile markers 6 and 7.",26,4 years,2755,Gunfire,"Saturday, July 4, 2020",Cause: Gunfire Weapon: Handgun Offender: Committed suicide,Anthony Dia,100.0
