source_url,name,bio,age,tour,badge,cause,end_of_watch,incident_details,matched_input_name,fuzzy_score
https://www.odmp.org/officer/25069-police-officer-brandon-michael-stalker,Police Officer Brandon Michael Stalker,"Police Officer Brandon Stalker was shot and killed at about 6:30 pm during a barricade involving an arson suspect. At approximately 2:20 am, the front doors of the historic Rosary Cathedral had been set on fire, and racial statements were spray painted onto the walls. At approximately 3:30 pm, officers spotted the suspect near his house in the 2300 block of Fulton Street and attempted to talk to him. The man drew a handgun and ran into a home where he barricaded himself inside. The department's SWAT team responded to the scene and, after negotiations failed, fired a chemical irritant into the home in an attempt to force him outside. The man emerged from the home holding two handguns and opened fire. Officer Stalker, who was on a perimeter position, was struck in the head and fatally wounded. Other officers returned fire and killed the subject. Officer Stalker had served with the Toledo Police Department for 2-1/2 years. He is survived by his two children and fiancée.",24,"2 years, 6 months",514,Gunfire,"Monday, January 18, 2021",Cause: Gunfire Weapon: Handgun Offender: Shot and killed,Brandon Stalker,100.0
https://www.odmp.org/officer/25150-natural-resources-officer-jason-scott-lagore,Natural Resources Officer Jason Scott Lagore,Natural Resources Officer Jason Lagore died after suffering a medical emergency while conducting a search for a juvenile who had fallen through the ice at Rocky Fork Lake at Rocky Fork State Park. Two juveniles had fallen through the ice but one was able to get to shore. Officer Lagore and other first responders were searching for the other juvenile when he suffered a medical emergency. He was transported Highland District Hospital where he was pronounced dead. The second juvenile was recovered from the water a short time later and also pronounced dead at a local hospital. Officer Lagore had served with the Ohio Department of Natural Resources - Division of State Parks and Watercraft for 15 years. He is survived by his wife and two young sons.,36,15 years,Not available,Duty related illness,"Tuesday, February 23, 2021",Cause: Duty related illness,Natural Resources Jason Lagore,100.0
https://www.odmp.org/officer/25841-patrolman-sean-e-vandenberg,Patrolman Sean E. VanDenberg,"Patrolman Sean VanDenberg died from complications as a result of contracting COVID-19 from arresting and transporting a COVID-19 positive suspect to jail after serving a warrant at a home in the 15400 block of Wooster Street NW in North Lawrence. Patrolman VanDenberg had served with the Lawrence Township Police Department for eight years. He is survived by his wife, four children, and two grandchildren.",54,8 years,792,COVID19,"Saturday, December 25, 2021","Cause: COVID19 Incident Date: Friday, December 3, 2021",Patrolman Sean VanDenberg,100.0
https://www.odmp.org/officer/26106-police-officer-dominic-m-francis,Police Officer Dominic M. Francis,"Police Officer Dominic Francis was struck and killed by a vehicle while deploying spike strips near mile marker 142 on southbound I-75 at about 2:30 am. Troopers with the Ohio State Highway Patrol had started pursuing the vehicle on State Route 15 after attempting a traffic stop. The vehicle fled onto I-75 and reached speeds exceeding 130 mph before striking Officer Francis. The three occupants of the vehicle then fled the scene on foot. All three were taken into custody over the next 10 hours. One subject was sentenced to 24 months for the charge of failure to comply and one year for receiving stolen property after pleading guilty. Officer Francis had served in law enforcement for 19 years. He is survived by his wife, son, and daughter. A stretch of I-75 that runs through Bufton was renamed the Officer Dominic Francis Memorial Highway. Signs are located at mile marker 139 Northbound and 143 Southbound.",42,19 years,Not available,Vehicle pursuit,"Thursday, March 31, 2022",Cause: Vehicle pursuit Weapon: Automobile Offender: Apprehended,Dominic Francis,100.0
https://www.odmp.org/officer/26302-deputy-sheriff-matthew-eugene-yates,Deputy Sheriff Matthew Eugene Yates,"Deputy Sheriff Matthew Yates was shot and killed while responding to shots fired call at the 1100 block of Ashwood Drive in South Charleston. At 10:51 am, Clark County Sheriff's Office received a 911 call reporting that a female subject had broken into a residence and fired five or six shots. When Deputy Yates and another deputy attempted to check the mobile home, they were met with gunfire. Deputy Yates was shot inside the trailer and was trapped inside for hours during the standoff with the subject. Clark County Special Operations and other tactical teams were called to rescue him. Deputy Yates was flown to the Miami Valley Hospital, where he succumbed to his injuries. A second deputy was injured while trying to escape the gunfire. The subject was shot and killed. Deputy Yates had served with the Clark County Sheriff's Office for 15 years. He is survived by his wife, daughter, two stepsons, and father, who retired from the Clark County Sheriff's Office.",41,15 years,12-60,Gunfire,"Sunday, July 24, 2022",Cause: Gunfire Weapon: Gun; Unknown type Offender: Shot and killed,Deputy Sheriff Matthew Yates,100.0
https://www.odmp.org/officer/3239-patrolman-david-l-cole,Patrolman David L. Cole,"Patrolman David Cole was shot and killed after responding to an alarm call at United Dairy Farmers at 2373 Florence Avenue. When he arrived on the scene, he observed two men walking nearby. As he approached them, they opened fire, wounding him twice. One of the suspects then took Patrolman Cole's revolver and shot him again. Patrolman Cole was transported to a local hospital where he succumbed to his wounds. Both suspects, both 23, were sentenced to death but had the sentences commuted to life. One of the men was paroled in 1991 and moved to California. The other suspect has been denied parole four times, and the next hearing is on March 1, 2027. Patrolman Cole was an Ohio National Guard veteran and had served with the Cincinnati Police Department for five years. His father was also a Cincinnati Police Officer. He was survived by his wife, parents, and four siblings. In September 2021, a street near Florence and Gilbert Avenues in Walnut Hills was named after Patrolman David Cole.  In 2023, a portion of Interstate 71 was dedicated as “Patrolman David L. Cole Memorial Highway.” He is buried in Saint Peter Cemetery, New Richmond, Ohio.",24,5 years,P160,Gunfire,"Wednesday, July 17, 1974","Cause: Gunfire Incident Date: Sunday, July 14, 1974 Weapon: Officer's handgun Offender: Two sentenced to life. One paroled",Patrolman David L. Cole,100.0
https://www.odmp.org/officer/4433-trooper-jody-s-dye,Trooper Jody S. Dye,"Trooper Jody Dye was struck and killed while placing flares in the roadway at a crash scene at the interchange of I-270 and US Route 33 in Columbus at 10 pm. He was transported to a Columbus hospital, where he succumbed to his injuries an hour later. Trooper Dye had served with the Ohio Highway Patrol for over three years and was assigned to the Granville Post. He is survived by his wife and two young daughters.",25,"3 years, 6 months",318/1307,Struck by vehicle,"Friday, July 5, 1985",Cause: Struck by vehicle,Trooper Jody S. Dye,100.0
https://www.odmp.org/officer/455-patrolman-brett-david-markwood,Patrolman Brett David Markwood,"Patrolman Brett Markwood was shot and killed while chasing a man suspected of robbing a Dairy Mart store. Patrolman Markwood and other officers had been called to the scene and were able to follow footprints that were left in the fresh snow. The officers caught sight of the man, and a foot chase ensued. The suspect rounded the corner of a house at 1019 Second Street and then lay in wait for the first officer. Patrolman Markwood turned the corner, and the suspect shot him in the face at close range and then ran past him. The suspect was arrested about 10 minutes later after trying to submerge himself in a nearby creek. He was convicted and sentenced to life imprisonment. He died in prison on January 31st, 2011. Patrolman Markwood had served with the Lancaster Police Department for three years. He is survived by his wife.",30,3 years,74,Gunfire,"Sunday, February 21, 1993",Cause: Gunfire Weapon: Handgun; .38 caliber Offender: Died in prison,Brett Markwood,100.0
https://www.odmp.org/officer/4685-trooper-wendy-g-everett,Trooper Wendy G. Everett,"Trooper Wendy Everett was struck and killed by an automobile while standing next to her patrol car on I-270. She was taking a report from a trucker whose windshield had been smashed by a water balloon dropped from a freeway bridge near Circleville, Ohio. The driver who killed Trooper Everett turned himself in the next day. He plead guilty to involuntary manslaughter, was sentenced to two to 10 years in prison, and was released on shock parole after serving 18 months. Trooper Everett had served three years with the Ohio State Highway Patrol. She was survived by her parents and sister.",25,3 years,584/586,Struck by vehicle,"Friday, August 5, 1988",Cause: Struck by vehicle,Trooper Wendy G. Everett,100.0
https://www.odmp.org/officer/5096-patrolman-james-a-fredericka,Patrolman James A. Fredericka,"Patrolman James Fredericka succumbed to injuries sustained eight days earlier when he lost control of his patrol car on a wet roadway and struck a tree while responding to an accident call. The accident occurred on State Route 7 in Trumbull County. He was transported to a hospital in Sharon, Pennsylvania, where he succumbed to his injuries. Patrolman Fredericka was a U.S. Army veteran of WWII. He was survived by his wife, two children, and parents. In February 2020, Trumbull Highway was renamed James A. Fredericka Memorial Highway.",38,5 years,289/328,Automobile crash,"Friday, May 8, 1953","Cause: Automobile crash Incident Date: Thursday, April 30, 1953",Patrolman James A. Fredericka,100.0
https://www.odmp.org/officer/5280-patrolman-james-p-gardner,Patrolman James P. Gardner,"Patrolman James Gardner was killed in an automobile crash while pursuing a vehicle at 8:20 p.m. His patrol car collided with another vehicle and then struck a telephone pole on Highway 62 near Alliance. The other patrolman in the vehicle was seriously injured. Patrolman Gardner was a U.S. Navy veteran of WWII and had served with the Ohio State Highway Patrol for only 5 months, assigned to the Massillon Post. He was survived by his parents.",24,5 months,172/455,Automobile crash,"Saturday, February 28, 1948",Cause: Automobile crash,Patrolman James P. Gardner,100.0
https://www.odmp.org/officer/5729-patrolman-william-j-greller,Patrolman William J. Greller,"Patrolman William Greller was shot and killed when he and another officer interrupted a robbery in progress at a local meat packing plant. The two officer had gone to the plant to interview the owner about a previous burglary. Coincidentally, when they arrived, the plant's office was being robbed. The suspect immediately opened fire on the two officers, striking Patrolman Greller in the chest twice. The other officer was shot in the arm but was able to return fire and kill the suspect. Patrolman Greller had served with the Cleveland Police Department for six years. He was survived by his wife and four sons.",34,6 years,1210,Gunfire,"Friday, September 18, 1964",Cause: Gunfire Weapon: Gun; Unknown type Offender: Shot and killed,Patrolman William J. Keller,94.54545454545455
https://www.odmp.org/officer/6717-patrolman-frank-j-hossler,Patrolman Frank J. Hossler,"Patrolman Frank Hossler was killed in an automobile crash while on patrol at 7:30 p.m. Patrolman Hossler was traveling north on State Route 69 (present-day SR 235) when his cruiser collided with another vehicle. He died at the scene. Patrolman Hossler was a United States Marine Corps Korean War Purple Heart recipient and had served with the Ohio State Highway Patrol for 10 months, assigned to the Bellefontaine Post. He was survived by his expectant wife.",25,10 months,163/761,Automobile crash,"Saturday, September 22, 1956",Cause: Automobile crash,Patrolman Frank J. Hossler,100.0
https://www.odmp.org/officer/7406-patrolman-william-j-keller,Patrolman William J. Keller,"Patrolman William Keller was struck and killed by a drunk driver while conducting a traffic stop on I-76 in Portage County. At 9:00 p.m., Patrolman Keller stopped a driver a mile west of the Ravenna exit (current day Prospect Street) when a vehicle traveling east hit the car, knocking Patrolman Keller into the roadway. The driver fled the scene. The driver was apprehended but died before standing trial. Patrolman Keller was a United States Army Vietnam War veteran and had served with the Ohio State Highway Patrol for 10 months, assigned to the Ravenna Post. He was survived by his wife, child, and parents.",27,10 months,Keller,Vehicular assault,"Saturday, October 14, 1972",Cause: Vehicular assault Weapon: Automobile; Alcohol involved Offender: Not available,Patrolman William J. Keller,100.0
https://www.odmp.org/officer/7609-deputy-sheriff-emil-r-kleinwaechter,Deputy Sheriff Emil R. Kleinwaechter,"Deputy Sheriff Emil Kleinwaechter was struck and killed by a vehicle while directing traffic around the scene of a serious vehicle crash on Wooster Pike, east of Newtown Road. He had tended to the injured citizen and then set out flares to warn oncoming traffic. He and another officer were directing traffic around the wreckage when another car entered the area at a high rate of speed. The vehicle struck Deputy Kleinwaechter, killing him instantly and throwing his body 87 feet. The driver of the car that struck him was convicted of second-degree manslaughter and sentenced to prison. Deputy Kleinwaechter was a U.S. Army veteran and had served with the Hamilton County Sheriff's Office for 13 years. He was survived by his wife and four children.",43,14 years,Not available,Struck by vehicle,"Monday, July 16, 1962",Cause: Struck by vehicle,Deputy Sheriff Emil Kleinwaechter,100.0
https://www.odmp.org/officer/830-deputy-sheriff-chad-steven-edwards,Deputy Sheriff Chad Steven Edwards,"Deputy Sheriff Chad Edwards was killed in a vehicle crash while en route to an undercover narcotics assignment. The crash occurred on State Route 37 near Leonard Road. Deputy Edwards had served with the Fairfield County Sheriff's Office for over one month. He is survived by his parents, sister, and fiancée.",22,"1 month, 2 weeks",Not available,Automobile crash,"Thursday, May 18, 1995",Cause: Automobile crash,Deputy Chad Edwards,100.0
https://www.odmp.org/officer/9085-patrolman-paul-l-mcmanis,Patrolman Paul L. McManis,"Patrolman Paul McManis was killed in an automobile crash on State Route 269, five miles north of Bellevue while responding to another crash. The patrol car was clipped while passing another vehicle which did not signal that they were making a left turn. The patrol car spun around, and both officers were thrown from the car. Patrolman McManis was killed instantly. The other officer suffered serious injuries. Patrolman McManis had served with the Ohio State Highway Patrol for five months and was stationed at Bellevue.",28,5 months,13/39,Automobile crash,"Sunday, September 28, 1941",Cause: Automobile crash,Patrolman Paul L. McManis,100.0
https://www.odmp.org/officer/9652-sergeant-william-r-morris,Sergeant William R. Morris,"Sergeant Bill Morris was shot and killed while responding to a call involving two juveniles trying to steal a vehicle on County Road 25A north of State Route 571 in Tipp City. Sergeant Morris responded to a call of two teenagers, one armed with a rifle, trying to steal a car. Sergeant Morris, driving an unmarked vehicle, found the boys and ordered them to get on the ground at gunpoint. The 15-year-old took off running while the 16-year-old raised an M1 Carbine above his head, claiming it was unloaded, then lowered the rifle and fired on Sergeant Morris, who used his cruiser to shield himself. Sergeant Morris and the suspect circled the cruiser, each firing until Sergeant Morris was hit and knocked into a ditch. The 16-year-old shooter then jumped into the cruiser and drove a short distance before backing up and firing two more rounds into Sergeant Morris as he lay in the ditch. He then drove a short distance and hid in a barn, where he later committed suicide with the same rifle after being surrounded by other officers. Sergeant Morris had served with the Miami County Sheriff's Office for 22 years. He was survived by his wife, daughter, and three sons. He is buried at Miami Memorial Park. West State Route 55 from the City of Troy west corporation to State Route 48 was renamed the Sheriff Sergeant William ""Bill"" Morris Memorial Highway.",42,22 years,Not available,Gunfire,"Wednesday, November 22, 1972",Cause: Gunfire Weapon: Gun; Unknown type Offender: Committed suicide,Sheriff Sergeant William ‘Bill’ Morris,93.87755102040816
https://www.odmp.org/officer/9875-patrolman-jerry-r-neff,Patrolman Jerry R. Neff,"Patrolman Jerry Neff was killed when a suspect driving a stolen vehicle recklessly drove off of a highway overpass and crashed into Patrolman Neff's patrol car below. The suspect's car landed on top of the patrol car at the junction of I-71 and US Route 62 at 9:15 a.m. The 19-year-old driver was charged with vehicular homicide and reckless driving. His 20-year-old passenger was charged with vehicular homicide and motor vehicle theft. Patrolman Neff had served with the Ohio State Highway Patrol for three years and was assigned to the Circleville Post at the time of the incident. He was survived by his wife, three children, and father.",27,3 years,932/1151,Vehicular assault,"Wednesday, January 30, 1974",Cause: Vehicular assault Weapon: Automobile Offender: Charged with vehicular homicide,Patrolman Jerry R. Neff,100.0
